root@lamp-ubuntu-s-1vcpu-1gb-tor1-01:~# tcpdump -i eth0 -c 5
tcpdump: verbose output suppressed, use -v or -vv for full protocol decode
listening on eth0, link-type EN10MB (Ethernet), capture size 262144 bytes
01:59:45.918751 IP 134.122.47.167.ssh > 38.64.227.143.56749: Flags [P.], seq 3059769490:3059769598, ack 2778192495, win 501, length 108
01:59:45.918861 IP 134.122.47.167.ssh > 38.64.227.143.56749: Flags [P.], seq 108:144, ack 1, win 501, length 36
01:59:45.918980 IP 134.122.47.167.ssh > 38.64.227.143.56749: Flags [P.], seq 144:252, ack 1, win 501, length 108
01:59:45.919057 IP 134.122.47.167.ssh > 38.64.227.143.56749: Flags [P.], seq 252:288, ack 1, win 501, length 36
01:59:45.919721 IP 134.122.47.167.51326 > dns.google.domain: 44470+ PTR? 143.227.64.38.in-addr.arpa. (44)
5 packets captured
22 packets received by filter
0 packets dropped by kernel