root@lamp-ubuntu-s-1vcpu-1gb-tor1-01:~# tcpdump -r 0001.pcap
reading from file 0001.pcap, link-type EN10MB (Ethernet)
02:04:54.879713 IP 134.122.47.167.ssh > 38.64.227.143.56749: Flags [P.], seq 3063136566:3063136610, ack 2778199487, win 501, length 44
02:04:54.879774 IP 134.122.47.167.ssh > 38.64.227.143.56749: Flags [P.], seq 44:152, ack 1, win 501, length 108
02:04:54.879844 IP 134.122.47.167.ssh > 38.64.227.143.56749: Flags [P.], seq 152:188, ack 1, win 501, length 36
02:04:54.900703 IP 38.64.227.143.56749 > 134.122.47.167.ssh: Flags [.], ack 44, win 4115, length 0
02:04:54.900732 IP 38.64.227.143.56749 > 134.122.47.167.ssh: Flags [.], ack 188, win 4114, length 0
02:04:56.556674 IP scanner-10.ch1.censys-scanner.com.11340 > 134.122.47.167.9078: Flags [S], seq 1454390617, win 1024, options [mss 1460], length 0
02:04:56.556709 IP 134.122.47.167.9078 > scanner-10.ch1.censys-scanner.com.11340: Flags [R.], seq 0, ack 1454390618, win 0, length 0
02:05:01.943176 IP 138.99.216.142.58964 > 134.122.47.167.3328: Flags [S], seq 2938083029, win 1024, length 0
02:05:01.943220 IP 134.122.47.167.3328 > 138.99.216.142.58964: Flags [R.], seq 0, ack 2938083030, win 0, length 0
02:05:02.040384 IP 138.99.216.142.58964 > 134.122.47.167.3328: Flags [R], seq 2938083030, win 1200, length 0
02:05:02.069112 IP 38.64.227.143.56749 > 134.122.47.167.ssh: Flags [P.], seq 1:69, ack 188, win 4114, length 68
02:05:02.115352 IP 134.122.47.167.ssh > 38.64.227.143.56749: Flags [.], ack 69, win 501, length 0
02:05:02.962348 IP 38.64.227.143.56749 > 134.122.47.167.ssh: Flags [P.], seq 69:137, ack 188, win 4114, length 68
02:05:02.962388 IP 134.122.47.167.ssh > 38.64.227.143.56749: Flags [.], ack 137, win 501, length 0
02:05:03.692836 IP 81.70.96.13.51952 > 134.122.47.167.ssh: Flags [FP.], seq 3720561591:3720562079, ack 3225359102, win 245, options [nop,nop,TS val 2863250944 ecr 2965251465], length 488
02:05:03.698518 IP 134.122.47.167.ssh > 81.70.96.13.51952: Flags [P.], seq 1:281, ack 489, win 507, options [nop,nop,TS val 2965276396 ecr 2863250944], length 280
02:05:03.701335 IP 134.122.47.167.ssh > 81.70.96.13.51952: Flags [F.], seq 281, ack 489, win 507, options [nop,nop,TS val 2965276399 ecr 2863250944], length 0
02:05:03.929881 IP 81.70.96.13.51952 > 134.122.47.167.ssh: Flags [R], seq 3720562080, win 0, length 0
02:05:03.932450 IP 81.70.96.13.51952 > 134.122.47.167.ssh: Flags [R], seq 3720562080, win 0, length 0
02:05:08.077746 IP 138.197.66.68.35992 > 134.122.47.167.ssh: Flags [S], seq 1257588075, win 29200, options [mss 1460,sackOK,TS val 3399869447 ecr 0,nop,wscale 8], length 0
02:05:08.077790 IP 134.122.47.167 > 138.197.66.68: ICMP 134.122.47.167 tcp port ssh unreachable, length 68
02:05:08.135833 IP 38.64.227.143.56749 > 134.122.47.167.ssh: Flags [P.], seq 137:173, ack 188, win 4114, length 36
02:05:08.135877 IP 134.122.47.167.ssh > 38.64.227.143.56749: Flags [.], ack 173, win 501, length 0
02:05:08.136122 IP 134.122.47.167.ssh > 38.64.227.143.56749: Flags [P.], seq 188:224, ack 173, win 501, length 36
02:05:08.194344 IP 38.64.227.143.56749 > 134.122.47.167.ssh: Flags [.], ack 224, win 4114, length 0
02:05:08.580129 IP 38.64.227.143.56749 > 134.122.47.167.ssh: Flags [P.], seq 173:209, ack 224, win 4114, length 36
02:05:08.580197 IP 134.122.47.167.ssh > 38.64.227.143.56749: Flags [.], ack 209, win 501, length 0
02:05:08.580428 IP 134.122.47.167.ssh > 38.64.227.143.56749: Flags [P.], seq 224:260, ack 209, win 501, length 36
02:05:08.637712 IP 38.64.227.143.56749 > 134.122.47.167.ssh: Flags [.], ack 260, win 4114, length 0
02:05:08.814887 IP 45.226.148.254.http > 134.122.47.167.http: Flags [S], seq 1328153497, win 65279, length 0
02:05:08.904524 IP 38.64.227.143.56749 > 134.122.47.167.ssh: Flags [P.], seq 209:245, ack 260, win 4114, length 36
02:05:08.904569 IP 134.122.47.167.ssh > 38.64.227.143.56749: Flags [.], ack 245, win 501, length 0
02:05:08.904726 IP 134.122.47.167.ssh > 38.64.227.143.56749: Flags [P.], seq 260:296, ack 245, win 501, length 36
02:05:08.965027 IP 38.64.227.143.56749 > 134.122.47.167.ssh: Flags [.], ack 296, win 4114, length 0
02:05:09.127364 IP 45.226.148.254.http > 134.122.47.167.http: Flags [S], seq 1525612610, win 1748, length 0
02:05:09.790762 IP 38.64.227.143.56749 > 134.122.47.167.ssh: Flags [P.], seq 245:289, ack 296, win 4114, length 44
02:05:09.790996 IP 134.122.47.167.ssh > 38.64.227.143.56749: Flags [P.], seq 296:340, ack 289, win 501, length 44
02:05:09.850040 IP 38.64.227.143.56749 > 134.122.47.167.ssh: Flags [.], ack 340, win 4114, length 0
02:05:10.081821 IP 38.64.227.143.56749 > 134.122.47.167.ssh: Flags [P.], seq 289:333, ack 340, win 4114, length 44
02:05:10.082005 IP 134.122.47.167.ssh > 38.64.227.143.56749: Flags [P.], seq 340:384, ack 333, win 501, length 44
02:05:10.149448 IP 38.64.227.143.56749 > 134.122.47.167.ssh: Flags [.], ack 384, win 4113, length 0
02:05:11.204657 IP 38.64.227.143.56749 > 134.122.47.167.ssh: Flags [P.], seq 333:369, ack 384, win 4113, length 36
02:05:11.204840 IP 134.122.47.167.ssh > 38.64.227.143.56749: Flags [P.], seq 384:428, ack 369, win 501, length 44
02:05:11.272692 IP 38.64.227.143.56749 > 134.122.47.167.ssh: Flags [.], ack 428, win 4113, length 0
02:05:11.690322 IP 38.64.227.143.56749 > 134.122.47.167.ssh: Flags [P.], seq 369:405, ack 428, win 4113, length 36
02:05:11.690511 IP 134.122.47.167.ssh > 38.64.227.143.56749: Flags [P.], seq 428:472, ack 405, win 501, length 44
02:05:11.714860 IP 38.64.227.143.56749 > 134.122.47.167.ssh: Flags [P.], seq 405:441, ack 472, win 4113, length 36
02:05:11.715124 IP 134.122.47.167.ssh > 38.64.227.143.56749: Flags [P.], seq 472:516, ack 441, win 501, length 44
02:05:11.742233 IP 38.64.227.143.56749 > 134.122.47.167.ssh: Flags [P.], seq 441:477, ack 516, win 4113, length 36
02:05:11.742416 IP 134.122.47.167.ssh > 38.64.227.143.56749: Flags [P.], seq 516:560, ack 477, win 501, length 44
02:05:11.772982 IP 38.64.227.143.56749 > 134.122.47.167.ssh: Flags [P.], seq 477:513, ack 560, win 4113, length 36
02:05:11.773187 IP 134.122.47.167.ssh > 38.64.227.143.56749: Flags [P.], seq 560:604, ack 513, win 501, length 44
02:05:11.810384 IP 38.64.227.143.56749 > 134.122.47.167.ssh: Flags [P.], seq 513:549, ack 604, win 4113, length 36
02:05:11.810567 IP 134.122.47.167.ssh > 38.64.227.143.56749: Flags [P.], seq 604:648, ack 549, win 501, length 44
02:05:11.827871 IP 38.64.227.143.56749 > 134.122.47.167.ssh: Flags [P.], seq 549:585, ack 648, win 4112, length 36
02:05:11.860380 IP 38.64.227.143.56749 > 134.122.47.167.ssh: Flags [P.], seq 585:621, ack 648, win 4112, length 36
02:05:11.860502 IP 134.122.47.167.ssh > 38.64.227.143.56749: Flags [.], ack 621, win 501, length 0
02:05:11.896054 IP 38.64.227.143.56749 > 134.122.47.167.ssh: Flags [P.], seq 621:657, ack 648, win 4112, length 36
02:05:11.924752 IP 38.64.227.143.56749 > 134.122.47.167.ssh: Flags [P.], seq 657:693, ack 648, win 4112, length 36
02:05:11.924887 IP 134.122.47.167.ssh > 38.64.227.143.56749: Flags [.], ack 693, win 501, length 0
02:05:11.948026 IP 38.64.227.143.56749 > 134.122.47.167.ssh: Flags [P.], seq 693:729, ack 648, win 4112, length 36
02:05:11.980625 IP 38.64.227.143.56749 > 134.122.47.167.ssh: Flags [P.], seq 729:765, ack 648, win 4112, length 36
02:05:11.980769 IP 134.122.47.167.ssh > 38.64.227.143.56749: Flags [.], ack 765, win 501, length 0
02:05:12.017685 IP 38.64.227.143.56749 > 134.122.47.167.ssh: Flags [P.], seq 765:801, ack 648, win 4112, length 36
02:05:12.040606 IP 38.64.227.143.56749 > 134.122.47.167.ssh: Flags [P.], seq 801:837, ack 648, win 4112, length 36
02:05:12.040758 IP 134.122.47.167.ssh > 38.64.227.143.56749: Flags [.], ack 837, win 501, length 0
02:05:12.077539 IP 38.64.227.143.56749 > 134.122.47.167.ssh: Flags [P.], seq 837:873, ack 648, win 4112, length 36
02:05:12.123325 IP 134.122.47.167.ssh > 38.64.227.143.56749: Flags [.], ack 873, win 501, length 0
02:05:12.313219 IP 38.64.227.143.56749 > 134.122.47.167.ssh: Flags [P.], seq 873:909, ack 648, win 4112, length 36
02:05:12.313250 IP 134.122.47.167.ssh > 38.64.227.143.56749: Flags [.], ack 909, win 501, length 0
02:05:12.531121 IP 38.64.227.143.56749 > 134.122.47.167.ssh: Flags [P.], seq 909:945, ack 648, win 4112, length 36
02:05:12.531150 IP 134.122.47.167.ssh > 38.64.227.143.56749: Flags [.], ack 945, win 501, length 0
02:05:12.701774 IP 38.64.227.143.56749 > 134.122.47.167.ssh: Flags [P.], seq 945:981, ack 648, win 4112, length 36
02:05:12.701810 IP 134.122.47.167.ssh > 38.64.227.143.56749: Flags [.], ack 981, win 501, length 0
02:05:14.421231 IP 45.146.165.24.51932 > 134.122.47.167.x11: Flags [S], seq 1774291827, win 1024, length 0
02:05:14.421286 IP 134.122.47.167.x11 > 45.146.165.24.51932: Flags [R.], seq 0, ack 1774291828, win 0, length 0
02:05:14.751411 IP 45.146.165.24.51932 > 134.122.47.167.x11: Flags [R], seq 1774291828, win 1200, length 0
02:05:15.949123 IP 194.147.140.22.48812 > 134.122.47.167.802: Flags [S], seq 392680405, win 1024, length 0
02:05:15.949172 IP 134.122.47.167.802 > 194.147.140.22.48812: Flags [R.], seq 0, ack 392680406, win 0, length 0
02:05:16.059006 IP 194.147.140.22.48812 > 134.122.47.167.802: Flags [R], seq 392680406, win 1200, length 0
02:05:23.612489 IP scanner-23.ch1.censys-scanner.com.64653 > 134.122.47.167.22020: Flags [S], seq 2075182489, win 1024, options [mss 1460], length 0
02:05:23.612526 IP 134.122.47.167.22020 > scanner-23.ch1.censys-scanner.com.64653: Flags [R.], seq 0, ack 2075182490, win 0, length 0
02:05:23.659609 IP 139.155.30.115.56520 > 134.122.47.167.ssh: Flags [S], seq 2989353300, win 29200, options [mss 1424,sackOK,TS val 3744330630 ecr 0,nop,wscale 7], length 0
02:05:23.659663 IP 134.122.47.167 > 139.155.30.115: ICMP 134.122.47.167 tcp port ssh unreachable, length 68
02:05:24.053105 IP 45.226.148.254.http > 134.122.47.167.http: Flags [S], seq 2101879378, win 9694, length 0
02:05:24.694022 IP 139.155.30.115.56520 > 134.122.47.167.ssh: Flags [S], seq 2989353300, win 29200, options [mss 1424,sackOK,TS val 3744331665 ecr 0,nop,wscale 7], length 0
02:05:24.694063 IP 134.122.47.167 > 139.155.30.115: ICMP 134.122.47.167 tcp port ssh unreachable, length 68
02:05:34.104027 IP 117.50.9.112.50014 > 134.122.47.167.ssh: Flags [S], seq 2805429222, win 28240, options [mss 1412,sackOK,TS val 268304121 ecr 0,nop,wscale 7], length 0
02:05:34.104073 IP 134.122.47.167.ssh > 117.50.9.112.50014: Flags [S.], seq 3456935581, ack 2805429223, win 65160, options [mss 1460,sackOK,TS val 1822930815 ecr 268304121,nop,wscale 7], length 0
02:05:34.354734 IP 117.50.9.112.50014 > 134.122.47.167.ssh: Flags [.], ack 1, win 221, options [nop,nop,TS val 268304373 ecr 1822930815], length 0
02:05:34.370211 IP 134.122.47.167.ssh > 117.50.9.112.50014: Flags [P.], seq 1:42, ack 1, win 510, options [nop,nop,TS val 1822931081 ecr 268304373], length 41
02:05:34.620446 IP 117.50.9.112.50014 > 134.122.47.167.ssh: Flags [.], ack 42, win 221, options [nop,nop,TS val 268304638 ecr 1822931081], length 0
02:05:34.627803 IP 117.50.9.112.50014 > 134.122.47.167.ssh: Flags [P.], seq 1:22, ack 42, win 221, options [nop,nop,TS val 268304646 ecr 1822931081], length 21
02:05:34.627849 IP 134.122.47.167.ssh > 117.50.9.112.50014: Flags [.], ack 22, win 510, options [nop,nop,TS val 1822931338 ecr 268304646], length 0
02:05:34.629579 IP 134.122.47.167.ssh > 117.50.9.112.50014: Flags [P.], seq 42:1098, ack 22, win 510, options [nop,nop,TS val 1822931340 ecr 268304646], length 1056
02:05:34.882975 IP 117.50.9.112.50014 > 134.122.47.167.ssh: Flags [P.], seq 22:462, ack 1098, win 238, options [nop,nop,TS val 268304901 ecr 1822931340], length 440
02:05:34.883039 IP 134.122.47.167.ssh > 117.50.9.112.50014: Flags [.], ack 462, win 507, options [nop,nop,TS val 1822931594 ecr 268304901], length 0
02:05:35.133317 IP 117.50.9.112.50014 > 134.122.47.167.ssh: Flags [P.], seq 462:510, ack 1098, win 238, options [nop,nop,TS val 268305151 ecr 1822931594], length 48
02:05:35.133348 IP 134.122.47.167.ssh > 117.50.9.112.50014: Flags [.], ack 510, win 507, options [nop,nop,TS val 1822931844 ecr 268305151], length 0
02:05:35.139027 IP 134.122.47.167.ssh > 117.50.9.112.50014: Flags [P.], seq 1098:1378, ack 510, win 507, options [nop,nop,TS val 1822931850 ecr 268305151], length 280
02:05:35.399658 IP 117.50.9.112.50014 > 134.122.47.167.ssh: Flags [P.], seq 510:526, ack 1378, win 254, options [nop,nop,TS val 268305417 ecr 1822931850], length 16
02:05:35.399705 IP 134.122.47.167.ssh > 117.50.9.112.50014: Flags [.], ack 526, win 507, options [nop,nop,TS val 1822932110 ecr 268305417], length 0
02:05:35.649872 IP 117.50.9.112.50014 > 134.122.47.167.ssh: Flags [P.], seq 526:578, ack 1378, win 254, options [nop,nop,TS val 268305668 ecr 1822932110], length 52
02:05:35.649914 IP 134.122.47.167.ssh > 117.50.9.112.50014: Flags [.], ack 578, win 507, options [nop,nop,TS val 1822932361 ecr 268305668], length 0
02:05:35.650065 IP 134.122.47.167.ssh > 117.50.9.112.50014: Flags [P.], seq 1378:1430, ack 578, win 507, options [nop,nop,TS val 1822932361 ecr 268305668], length 52
02:05:35.905046 IP 117.50.9.112.50014 > 134.122.47.167.ssh: Flags [P.], seq 578:662, ack 1430, win 254, options [nop,nop,TS val 268305923 ecr 1822932361], length 84
02:05:35.947326 IP 134.122.47.167.ssh > 117.50.9.112.50014: Flags [.], ack 662, win 507, options [nop,nop,TS val 1822932658 ecr 268305923], length 0
02:05:38.966688 IP 221.181.185.198.16683 > 134.122.47.167.ssh: Flags [S], seq 2507703433, win 29200, options [mss 1460,sackOK,TS val 8061959 ecr 0,nop,wscale 7], length 0
02:05:38.966745 IP 134.122.47.167.ssh > 221.181.185.198.16683: Flags [S.], seq 2833603698, ack 2507703434, win 65160, options [mss 1460,sackOK,TS val 1363574182 ecr 8061959,nop,wscale 7], length 0
02:05:39.069988 IP 134.122.47.167.ssh > 117.50.9.112.50014: Flags [P.], seq 1430:1498, ack 662, win 507, options [nop,nop,TS val 1822935781 ecr 268305923], length 68
02:05:39.268846 IP 221.181.185.198.16683 > 134.122.47.167.ssh: Flags [.], ack 1, win 229, options [nop,nop,TS val 8062035 ecr 1363574182], length 0
02:05:39.268910 IP 221.181.185.198.16683 > 134.122.47.167.ssh: Flags [P.], seq 1:16, ack 1, win 229, options [nop,nop,TS val 8062035 ecr 1363574182], length 15
02:05:39.280053 IP 134.122.47.167.ssh > 221.181.185.198.16683: Flags [P.], seq 1:42, ack 1, win 510, options [nop,nop,TS val 1363574496 ecr 8062035], length 41
02:05:39.581667 IP 221.181.185.198.16683 > 134.122.47.167.ssh: Flags [.], ack 42, win 229, options [nop,nop,TS val 8062113 ecr 1363574496], length 0
02:05:39.695285 IP 134.122.47.167.ssh > 117.50.9.112.50014: Flags [P.], seq 1430:1498, ack 662, win 507, options [nop,nop,TS val 1822936406 ecr 268305923], length 68
02:05:39.896857 IP 117.50.9.112.50014 > 134.122.47.167.ssh: Flags [F.], seq 714, ack 1498, win 254, options [nop,nop,TS val 268309915 ecr 1822935781], length 0
02:05:39.896907 IP 134.122.47.167.ssh > 117.50.9.112.50014: Flags [.], ack 662, win 507, options [nop,nop,TS val 1822936608 ecr 268305923,nop,nop,sack 1 {714:715}], length 0
02:05:39.945456 IP 117.50.9.112.50014 > 134.122.47.167.ssh: Flags [.], ack 1498, win 254, options [nop,nop,TS val 268309963 ecr 1822936406,nop,nop,sack 1 {1430:1498}], length 0
02:05:40.175099 IP 221.181.185.198.16683 > 134.122.47.167.ssh: Flags [P.], seq 16:872, ack 42, win 229, options [nop,nop,TS val 8062262 ecr 1363574496], length 856
02:05:41.083053 IP 221.181.185.198.16683 > 134.122.47.167.ssh: Flags [P.], seq 1:872, ack 42, win 229, options [nop,nop,TS val 8062489 ecr 1363574496], length 871
02:05:41.083105 IP 134.122.47.167.ssh > 221.181.185.198.16683: Flags [.], ack 872, win 504, options [nop,nop,TS val 1363576299 ecr 8062489], length 0
02:05:41.084600 IP 134.122.47.167.ssh > 221.181.185.198.16683: Flags [P.], seq 42:1098, ack 872, win 504, options [nop,nop,TS val 1363576300 ecr 8062489], length 1056
02:05:41.386150 IP 221.181.185.198.16683 > 134.122.47.167.ssh: Flags [.], ack 1098, win 245, options [nop,nop,TS val 8062564 ecr 1363576300], length 0
02:05:41.386250 IP 221.181.185.198.16683 > 134.122.47.167.ssh: Flags [P.], seq 872:952, ack 1098, win 245, options [nop,nop,TS val 8062564 ecr 1363576300], length 80
02:05:41.386263 IP 134.122.47.167.ssh > 221.181.185.198.16683: Flags [.], ack 952, win 504, options [nop,nop,TS val 1363576602 ecr 8062564], length 0
02:05:41.387392 IP 134.122.47.167.ssh > 221.181.185.198.16683: Flags [P.], seq 1098:1410, ack 952, win 504, options [nop,nop,TS val 1363576603 ecr 8062564], length 312
02:05:41.689858 IP 221.181.185.198.16683 > 134.122.47.167.ssh: Flags [P.], seq 952:968, ack 1410, win 262, options [nop,nop,TS val 8062640 ecr 1363576603], length 16
02:05:41.689934 IP 134.122.47.167.ssh > 221.181.185.198.16683: Flags [.], ack 968, win 504, options [nop,nop,TS val 1363576906 ecr 8062640], length 0
02:05:41.991717 IP 221.181.185.198.16683 > 134.122.47.167.ssh: Flags [P.], seq 968:1032, ack 1410, win 262, options [nop,nop,TS val 8062716 ecr 1363576906], length 64
02:05:41.991748 IP 134.122.47.167.ssh > 221.181.185.198.16683: Flags [.], ack 1032, win 504, options [nop,nop,TS val 1363577207 ecr 8062716], length 0
02:05:41.991875 IP 134.122.47.167.ssh > 221.181.185.198.16683: Flags [P.], seq 1410:1474, ack 1032, win 504, options [nop,nop,TS val 1363577207 ecr 8062716], length 64
02:05:42.293571 IP 221.181.185.198.16683 > 134.122.47.167.ssh: Flags [P.], seq 1032:1112, ack 1474, win 262, options [nop,nop,TS val 8062791 ecr 1363577207], length 80
02:05:42.300059 IP 134.122.47.167.ssh > 221.181.185.198.16683: Flags [P.], seq 1474:1554, ack 1112, win 504, options [nop,nop,TS val 1363577516 ecr 8062791], length 80
02:05:42.601719 IP 221.181.185.198.16683 > 134.122.47.167.ssh: Flags [P.], seq 1112:1208, ack 1554, win 262, options [nop,nop,TS val 8062868 ecr 1363577516], length 96
02:05:42.643325 IP 134.122.47.167.ssh > 221.181.185.198.16683: Flags [.], ack 1208, win 504, options [nop,nop,TS val 1363577859 ecr 8062868], length 0
02:05:44.232002 IP zg-1218a-206.stretchoid.com.50170 > 134.122.47.167.ssh: Flags [S], seq 444518488, win 65535, length 0
02:05:44.232049 IP 134.122.47.167.ssh > zg-1218a-206.stretchoid.com.50170: Flags [S.], seq 1105137355, ack 444518489, win 64240, options [mss 1460], length 0
02:05:45.263327 IP 134.122.47.167.ssh > zg-1218a-206.stretchoid.com.50170: Flags [S.], seq 1105137355, ack 444518489, win 64240, options [mss 1460], length 0
02:05:45.766637 IP 134.122.47.167.ssh > 221.181.185.198.16683: Flags [P.], seq 1554:1634, ack 1208, win 504, options [nop,nop,TS val 1363580982 ecr 8062868], length 80
02:05:46.068582 IP 221.181.185.198.16683 > 134.122.47.167.ssh: Flags [P.], seq 1208:1304, ack 1634, win 262, options [nop,nop,TS val 8063735 ecr 1363580982], length 96
02:05:46.068617 IP 134.122.47.167.ssh > 221.181.185.198.16683: Flags [.], ack 1304, win 504, options [nop,nop,TS val 1363581284 ecr 8063735], length 0
02:05:47.279332 IP 134.122.47.167.ssh > zg-1218a-206.stretchoid.com.50170: Flags [S.], seq 1105137355, ack 444518489, win 64240, options [mss 1460], length 0
02:05:47.349077 IP 61.177.173.16.29675 > 134.122.47.167.ssh: Flags [S], seq 1326667921, win 29200, options [mss 1460,sackOK,TS val 530642494 ecr 0,nop,wscale 7], length 0
02:05:47.349117 IP 134.122.47.167 > 61.177.173.16: ICMP 134.122.47.167 tcp port ssh unreachable, length 68
02:05:47.614533 IP 61.177.173.16.31697 > 134.122.47.167.ssh: Flags [S], seq 2470244966, win 29200, options [mss 1460,sackOK,TS val 530642558 ecr 0,nop,wscale 7], length 0
02:05:47.614575 IP 134.122.47.167 > 61.177.173.16: ICMP 134.122.47.167 tcp port ssh unreachable, length 68
02:05:47.879268 IP 61.177.173.16.33943 > 134.122.47.167.ssh: Flags [S], seq 1411538728, win 29200, options [mss 1460,sackOK,TS val 530642625 ecr 0,nop,wscale 7], length 0
02:05:47.879309 IP 134.122.47.167 > 61.177.173.16: ICMP 134.122.47.167 tcp port ssh unreachable, length 68
02:05:48.281106 IP 117.50.9.112.50014 > 134.122.47.167.ssh: Flags [P.], seq 662:714, ack 1498, win 254, options [nop,nop,TS val 268318299 ecr 1822936608], length 52
02:05:48.281156 IP 134.122.47.167.ssh > 117.50.9.112.50014: Flags [.], ack 715, win 507, options [nop,nop,TS val 1822944992 ecr 268318299], length 0
02:05:48.283270 IP 134.122.47.167.ssh > 117.50.9.112.50014: Flags [F.], seq 1498, ack 715, win 507, options [nop,nop,TS val 1822944994 ecr 268318299], length 0
02:05:48.533311 IP 117.50.9.112.50014 > 134.122.47.167.ssh: Flags [.], ack 1499, win 254, options [nop,nop,TS val 268318551 ecr 1822944994], length 0
02:05:49.233534 IP 134.122.47.167.ssh > 221.181.185.198.16683: Flags [P.], seq 1634:1714, ack 1304, win 504, options [nop,nop,TS val 1363584449 ecr 8063735], length 80
02:05:49.535275 IP 221.181.185.198.16683 > 134.122.47.167.ssh: Flags [P.], seq 1304:1400, ack 1714, win 262, options [nop,nop,TS val 8064602 ecr 1363584449], length 96
02:05:49.871318 IP 134.122.47.167.ssh > 221.181.185.198.16683: Flags [P.], seq 1634:1714, ack 1304, win 504, options [nop,nop,TS val 1363585087 ecr 8063735], length 80
02:05:50.130994 IP 221.181.185.198.16683 > 134.122.47.167.ssh: Flags [P.], seq 1304:1400, ack 1714, win 262, options [nop,nop,TS val 8064751 ecr 1363584449], length 96
02:05:50.131029 IP 134.122.47.167.ssh > 221.181.185.198.16683: Flags [.], ack 1400, win 504, options [nop,nop,TS val 1363585347 ecr 8064751], length 0
02:05:50.172888 IP 221.181.185.198.16683 > 134.122.47.167.ssh: Flags [.], ack 1714, win 262, options [nop,nop,TS val 8064761 ecr 1363585087,nop,nop,sack 1 {1634:1714}], length 0
02:05:51.407342 IP 134.122.47.167.ssh > zg-1218a-206.stretchoid.com.50170: Flags [S.], seq 1105137355, ack 444518489, win 64240, options [mss 1460], length 0
02:05:53.295955 IP 134.122.47.167.ssh > 221.181.185.198.16683: Flags [P.], seq 1714:1794, ack 1400, win 504, options [nop,nop,TS val 1363588512 ecr 8064761], length 80
02:05:53.595338 IP 221.181.185.198.59134 > 134.122.47.167.ssh: Flags [S], seq 121220950, win 29200, options [mss 1460,sackOK,TS val 8065617 ecr 0,nop,wscale 7], length 0
02:05:53.595393 IP 134.122.47.167.ssh > 221.181.185.198.59134: Flags [S.], seq 735184481, ack 121220951, win 65160, options [mss 1460,sackOK,TS val 1363588811 ecr 8065617,nop,wscale 7], length 0
02:05:53.597495 IP 221.181.185.198.16683 > 134.122.47.167.ssh: Flags [.], ack 1794, win 262, options [nop,nop,TS val 8065617 ecr 1363588512], length 0
02:05:53.597522 IP 221.181.185.198.16683 > 134.122.47.167.ssh: Flags [P.], seq 1400:1464, ack 1794, win 262, options [nop,nop,TS val 8065617 ecr 1363588512], length 64
02:05:53.597536 IP 134.122.47.167.ssh > 221.181.185.198.16683: Flags [.], ack 1464, win 504, options [nop,nop,TS val 1363588813 ecr 8065617], length 0
02:05:53.597576 IP 221.181.185.198.16683 > 134.122.47.167.ssh: Flags [F.], seq 1464, ack 1794, win 262, options [nop,nop,TS val 8065617 ecr 1363588512], length 0
02:05:53.602809 IP 134.122.47.167.ssh > 221.181.185.198.16683: Flags [F.], seq 1794, ack 1465, win 504, options [nop,nop,TS val 1363588818 ecr 8065617], length 0
02:05:53.900979 IP 221.181.185.198.59134 > 134.122.47.167.ssh: Flags [.], ack 1, win 229, options [nop,nop,TS val 8065694 ecr 1363588811], length 0
02:05:53.901058 IP 221.181.185.198.59134 > 134.122.47.167.ssh: Flags [P.], seq 1:16, ack 1, win 229, options [nop,nop,TS val 8065694 ecr 1363588811], length 15
02:05:53.901079 IP 134.122.47.167.ssh > 221.181.185.198.59134: Flags [.], ack 16, win 509, options [nop,nop,TS val 1363589117 ecr 8065694], length 0
02:05:53.904539 IP 221.181.185.198.16683 > 134.122.47.167.ssh: Flags [.], ack 1795, win 262, options [nop,nop,TS val 8065694 ecr 1363588818], length 0
02:05:53.912209 IP 134.122.47.167.ssh > 221.181.185.198.59134: Flags [P.], seq 1:42, ack 16, win 509, options [nop,nop,TS val 1363589128 ecr 8065694], length 41
02:05:54.217697 IP 221.181.185.198.59134 > 134.122.47.167.ssh: Flags [.], ack 42, win 229, options [nop,nop,TS val 8065773 ecr 1363589128], length 0
02:05:54.217732 IP 134.122.47.167.ssh > 221.181.185.198.59134: Flags [P.], seq 42:1098, ack 16, win 509, options [nop,nop,TS val 1363589433 ecr 8065773], length 1056
02:05:54.217752 IP 221.181.185.198.59134 > 134.122.47.167.ssh: Flags [P.], seq 16:872, ack 42, win 229, options [nop,nop,TS val 8065773 ecr 1363589128], length 856
02:05:54.217775 IP 134.122.47.167.ssh > 221.181.185.198.59134: Flags [.], ack 872, win 503, options [nop,nop,TS val 1363589433 ecr 8065773], length 0
02:05:54.523549 IP 221.181.185.198.59134 > 134.122.47.167.ssh: Flags [P.], seq 872:952, ack 1098, win 245, options [nop,nop,TS val 8065849 ecr 1363589128], length 80
02:05:54.523616 IP 134.122.47.167.ssh > 221.181.185.198.59134: Flags [.], ack 952, win 503, options [nop,nop,TS val 1363589739 ecr 8065849], length 0
02:05:54.524570 IP 134.122.47.167.ssh > 221.181.185.198.59134: Flags [P.], seq 1098:1410, ack 952, win 503, options [nop,nop,TS val 1363589740 ecr 8065849], length 312
02:05:54.650642 IP 45.146.165.171.53784 > 134.122.47.167.20799: Flags [S], seq 1740612957, win 1024, length 0
02:05:54.650685 IP 134.122.47.167.20799 > 45.146.165.171.53784: Flags [R.], seq 0, ack 1740612958, win 0, length 0
02:05:54.776076 IP 45.146.165.171.53784 > 134.122.47.167.20799: Flags [R], seq 1740612958, win 1200, length 0
02:05:54.830917 IP 221.181.185.198.59134 > 134.122.47.167.ssh: Flags [P.], seq 952:968, ack 1410, win 262, options [nop,nop,TS val 8065926 ecr 1363589740], length 16
02:05:54.830985 IP 134.122.47.167.ssh > 221.181.185.198.59134: Flags [.], ack 968, win 503, options [nop,nop,TS val 1363590047 ecr 8065926], length 0
02:05:55.005105 IP scan-12e.shadowserver.org.46859 > 134.122.47.167.32414: UDP, length 1
02:05:55.005169 IP 134.122.47.167 > scan-12e.shadowserver.org: ICMP 134.122.47.167 udp port 32414 unreachable, length 37
02:05:55.136458 IP 221.181.185.198.59134 > 134.122.47.167.ssh: Flags [P.], seq 968:1032, ack 1410, win 262, options [nop,nop,TS val 8066002 ecr 1363590047], length 64
02:05:55.136492 IP 134.122.47.167.ssh > 221.181.185.198.59134: Flags [.], ack 1032, win 503, options [nop,nop,TS val 1363590352 ecr 8066002], length 0
02:05:55.136652 IP 134.122.47.167.ssh > 221.181.185.198.59134: Flags [P.], seq 1410:1474, ack 1032, win 503, options [nop,nop,TS val 1363590352 ecr 8066002], length 64
02:05:55.442369 IP 221.181.185.198.59134 > 134.122.47.167.ssh: Flags [P.], seq 1032:1112, ack 1474, win 262, options [nop,nop,TS val 8066079 ecr 1363590352], length 80
02:05:55.442414 IP 134.122.47.167.ssh > 221.181.185.198.59134: Flags [.], ack 1112, win 503, options [nop,nop,TS val 1363590658 ecr 8066079], length 0
02:05:55.448878 IP 134.122.47.167.ssh > 221.181.185.198.59134: Flags [P.], seq 1474:1554, ack 1112, win 503, options [nop,nop,TS val 1363590664 ecr 8066079], length 80
02:05:55.754465 IP 221.181.185.198.59134 > 134.122.47.167.ssh: Flags [P.], seq 1112:1208, ack 1554, win 262, options [nop,nop,TS val 8066157 ecr 1363590664], length 96
02:05:55.795348 IP 134.122.47.167.ssh > 221.181.185.198.59134: Flags [.], ack 1208, win 503, options [nop,nop,TS val 1363591011 ecr 8066157], length 0
02:05:58.919434 IP 134.122.47.167.ssh > 221.181.185.198.59134: Flags [P.], seq 1554:1634, ack 1208, win 503, options [nop,nop,TS val 1363594135 ecr 8066157], length 80
02:05:59.225118 IP 221.181.185.198.59134 > 134.122.47.167.ssh: Flags [P.], seq 1208:1304, ack 1634, win 262, options [nop,nop,TS val 8067025 ecr 1363594135], length 96
02:05:59.225162 IP 134.122.47.167.ssh > 221.181.185.198.59134: Flags [.], ack 1304, win 503, options [nop,nop,TS val 1363594441 ecr 8067025], length 0
02:05:59.599340 IP 134.122.47.167.ssh > zg-1218a-206.stretchoid.com.50170: Flags [S.], seq 1105137355, ack 444518489, win 64240, options [mss 1460], length 0
02:05:59.721772 IP 4bc4d.rederatural.com.53657 > 134.122.47.167.8159: Flags [S], seq 3407360576, win 65535, options [mss 1460], length 0
02:05:59.721812 IP 134.122.47.167.8159 > 4bc4d.rederatural.com.53657: Flags [R.], seq 0, ack 3407360577, win 0, length 0
02:06:02.390088 IP 134.122.47.167.ssh > 221.181.185.198.59134: Flags [P.], seq 1634:1714, ack 1304, win 503, options [nop,nop,TS val 1363597606 ecr 8067025], length 80
02:06:02.695891 IP 221.181.185.198.59134 > 134.122.47.167.ssh: Flags [P.], seq 1304:1400, ack 1714, win 262, options [nop,nop,TS val 8067892 ecr 1363597606], length 96
02:06:02.695935 IP 134.122.47.167.ssh > 221.181.185.198.59134: Flags [.], ack 1400, win 503, options [nop,nop,TS val 1363597912 ecr 8067892], length 0
02:06:05.860849 IP 134.122.47.167.ssh > 221.181.185.198.59134: Flags [P.], seq 1714:1794, ack 1400, win 503, options [nop,nop,TS val 1363601076 ecr 8067892], length 80
02:06:06.017931 IP 194.147.140.28.50034 > 134.122.47.167.2631: Flags [S], seq 3481750456, win 1024, length 0
02:06:06.017977 IP 134.122.47.167.2631 > 194.147.140.28.50034: Flags [R.], seq 0, ack 3481750457, win 0, length 0
02:06:06.116280 IP 194.147.140.28.50034 > 134.122.47.167.2631: Flags [R], seq 3481750457, win 1200, length 0
02:06:06.166556 IP 221.181.185.198.59134 > 134.122.47.167.ssh: Flags [F.], seq 1464, ack 1794, win 262, options [nop,nop,TS val 8068760 ecr 1363601076], length 0
02:06:06.166610 IP 134.122.47.167.ssh > 221.181.185.198.59134: Flags [.], ack 1400, win 503, options [nop,nop,TS val 1363601382 ecr 8067892,nop,nop,sack 1 {1464:1465}], length 0
02:06:06.166633 IP 221.181.185.198.59134 > 134.122.47.167.ssh: Flags [P.], seq 1400:1464, ack 1794, win 262, options [nop,nop,TS val 8068760 ecr 1363601076], length 64
02:06:06.166665 IP 134.122.47.167.ssh > 221.181.185.198.59134: Flags [.], ack 1465, win 503, options [nop,nop,TS val 1363601382 ecr 8068760], length 0
02:06:06.168524 IP 221.181.185.198.27960 > 134.122.47.167.ssh: Flags [S], seq 1044362279, win 29200, options [mss 1460,sackOK,TS val 8068760 ecr 0,nop,wscale 7], length 0
02:06:06.168582 IP 134.122.47.167.ssh > 221.181.185.198.27960: Flags [S.], seq 1736031851, ack 1044362280, win 65160, options [mss 1460,sackOK,TS val 1363601384 ecr 8068760,nop,wscale 7], length 0
02:06:06.173563 IP 134.122.47.167.ssh > 221.181.185.198.59134: Flags [F.], seq 1794, ack 1465, win 503, options [nop,nop,TS val 1363601389 ecr 8068760], length 0
02:06:06.469698 IP 221.181.185.198.27960 > 134.122.47.167.ssh: Flags [.], ack 1, win 229, options [nop,nop,TS val 8068835 ecr 1363601384], length 0
02:06:06.469757 IP 221.181.185.198.27960 > 134.122.47.167.ssh: Flags [P.], seq 1:16, ack 1, win 229, options [nop,nop,TS val 8068835 ecr 1363601384], length 15
02:06:06.469770 IP 134.122.47.167.ssh > 221.181.185.198.27960: Flags [.], ack 16, win 509, options [nop,nop,TS val 1363601685 ecr 8068835], length 0
02:06:06.479072 IP 221.181.185.198.59134 > 134.122.47.167.ssh: Flags [.], ack 1795, win 262, options [nop,nop,TS val 8068838 ecr 1363601389], length 0
02:06:06.481256 IP 134.122.47.167.ssh > 221.181.185.198.27960: Flags [P.], seq 1:42, ack 16, win 509, options [nop,nop,TS val 1363601697 ecr 8068835], length 41
02:06:06.782279 IP 221.181.185.198.27960 > 134.122.47.167.ssh: Flags [.], ack 42, win 229, options [nop,nop,TS val 8068913 ecr 1363601697], length 0
02:06:06.782324 IP 134.122.47.167.ssh > 221.181.185.198.27960: Flags [P.], seq 42:1098, ack 16, win 509, options [nop,nop,TS val 1363601998 ecr 8068913], length 1056
02:06:06.782350 IP 221.181.185.198.27960 > 134.122.47.167.ssh: Flags [P.], seq 16:872, ack 42, win 229, options [nop,nop,TS val 8068913 ecr 1363601697], length 856
02:06:06.782381 IP 134.122.47.167.ssh > 221.181.185.198.27960: Flags [.], ack 872, win 503, options [nop,nop,TS val 1363601998 ecr 8068913], length 0
02:06:07.087345 IP 221.181.185.198.27960 > 134.122.47.167.ssh: Flags [P.], seq 872:952, ack 1098, win 245, options [nop,nop,TS val 8068989 ecr 1363601697], length 80
02:06:07.087400 IP 134.122.47.167.ssh > 221.181.185.198.27960: Flags [.], ack 952, win 503, options [nop,nop,TS val 1363602303 ecr 8068989], length 0
02:06:07.088448 IP 134.122.47.167.ssh > 221.181.185.198.27960: Flags [P.], seq 1098:1410, ack 952, win 503, options [nop,nop,TS val 1363602304 ecr 8068989], length 312
02:06:07.390242 IP 221.181.185.198.27960 > 134.122.47.167.ssh: Flags [P.], seq 952:968, ack 1410, win 262, options [nop,nop,TS val 8069065 ecr 1363602304], length 16
02:06:07.390292 IP 134.122.47.167.ssh > 221.181.185.198.27960: Flags [.], ack 968, win 503, options [nop,nop,TS val 1363602606 ecr 8069065], length 0
02:06:07.554234 IP 81.68.90.168.54600 > 134.122.47.167.ssh: Flags [S], seq 263153899, win 64240, options [mss 1424,sackOK,TS val 3875736620 ecr 0,nop,wscale 7], length 0
02:06:07.554293 IP 134.122.47.167.ssh > 81.68.90.168.54600: Flags [S.], seq 2393415921, ack 263153900, win 65160, options [mss 1460,sackOK,TS val 1902274333 ecr 3875736620,nop,wscale 7], length 0
02:06:07.691334 IP 221.181.185.198.27960 > 134.122.47.167.ssh: Flags [P.], seq 968:1032, ack 1410, win 262, options [nop,nop,TS val 8069141 ecr 1363602606], length 64
02:06:07.691392 IP 134.122.47.167.ssh > 221.181.185.198.27960: Flags [.], ack 1032, win 503, options [nop,nop,TS val 1363602907 ecr 8069141], length 0
02:06:07.691566 IP 134.122.47.167.ssh > 221.181.185.198.27960: Flags [P.], seq 1410:1474, ack 1032, win 503, options [nop,nop,TS val 1363602907 ecr 8069141], length 64
02:06:07.992678 IP 221.181.185.198.27960 > 134.122.47.167.ssh: Flags [P.], seq 1032:1112, ack 1474, win 262, options [nop,nop,TS val 8069216 ecr 1363602907], length 80
02:06:07.992723 IP 134.122.47.167.ssh > 221.181.185.198.27960: Flags [.], ack 1112, win 503, options [nop,nop,TS val 1363603208 ecr 8069216], length 0
02:06:07.999196 IP 134.122.47.167.ssh > 221.181.185.198.27960: Flags [P.], seq 1474:1554, ack 1112, win 503, options [nop,nop,TS val 1363603215 ecr 8069216], length 80
02:06:08.300266 IP 221.181.185.198.27960 > 134.122.47.167.ssh: Flags [P.], seq 1112:1208, ack 1554, win 262, options [nop,nop,TS val 8069293 ecr 1363603215], length 96
02:06:08.343321 IP 134.122.47.167.ssh > 221.181.185.198.27960: Flags [.], ack 1208, win 503, options [nop,nop,TS val 1363603559 ecr 8069293], length 0
02:06:08.559326 IP 134.122.47.167.ssh > 81.68.90.168.54600: Flags [S.], seq 2393415921, ack 263153900, win 65160, options [mss 1460,sackOK,TS val 1902275338 ecr 3875736620,nop,wscale 7], length 0
02:06:08.577616 IP 81.68.90.168.54600 > 134.122.47.167.ssh: Flags [S], seq 263153899, win 64240, options [mss 1424,sackOK,TS val 3875737644 ecr 0,nop,wscale 7], length 0
02:06:08.577654 IP 134.122.47.167.ssh > 81.68.90.168.54600: Flags [S.], seq 2393415921, ack 263153900, win 65160, options [mss 1460,sackOK,TS val 1902275356 ecr 3875736620,nop,wscale 7], length 0
02:06:08.811356 IP 81.68.90.168.54600 > 134.122.47.167.ssh: Flags [.], ack 1, win 502, options [nop,nop,TS val 3875737878 ecr 1902275356], length 0
02:06:08.822907 IP 134.122.47.167.ssh > 81.68.90.168.54600: Flags [P.], seq 1:42, ack 1, win 510, options [nop,nop,TS val 1902275602 ecr 3875737878], length 41
02:06:09.056722 IP 81.68.90.168.54600 > 134.122.47.167.ssh: Flags [.], ack 42, win 502, options [nop,nop,TS val 3875738123 ecr 1902275602], length 0
02:06:09.056777 IP 81.68.90.168.54600 > 134.122.47.167.ssh: Flags [P.], seq 1:22, ack 42, win 502, options [nop,nop,TS val 3875738123 ecr 1902275602], length 21
02:06:09.056794 IP 134.122.47.167.ssh > 81.68.90.168.54600: Flags [.], ack 22, win 510, options [nop,nop,TS val 1902275835 ecr 3875738123], length 0
02:06:09.058315 IP 134.122.47.167.ssh > 81.68.90.168.54600: Flags [P.], seq 42:1098, ack 22, win 510, options [nop,nop,TS val 1902275837 ecr 3875738123], length 1056
02:06:09.292033 IP 81.68.90.168.54600 > 134.122.47.167.ssh: Flags [P.], seq 22:462, ack 1098, win 501, options [nop,nop,TS val 3875738359 ecr 1902275837], length 440
02:06:09.292075 IP 134.122.47.167.ssh > 81.68.90.168.54600: Flags [.], ack 462, win 507, options [nop,nop,TS val 1902276071 ecr 3875738359], length 0
02:06:09.525707 IP 81.68.90.168.54600 > 134.122.47.167.ssh: Flags [P.], seq 462:510, ack 1098, win 501, options [nop,nop,TS val 3875738592 ecr 1902276071], length 48
02:06:09.525738 IP 134.122.47.167.ssh > 81.68.90.168.54600: Flags [.], ack 510, win 507, options [nop,nop,TS val 1902276304 ecr 3875738592], length 0
02:06:09.531732 IP 134.122.47.167.ssh > 81.68.90.168.54600: Flags [P.], seq 1098:1378, ack 510, win 507, options [nop,nop,TS val 1902276310 ecr 3875738592], length 280
02:06:09.767367 IP 81.68.90.168.54600 > 134.122.47.167.ssh: Flags [P.], seq 510:526, ack 1378, win 501, options [nop,nop,TS val 3875738834 ecr 1902276310], length 16
02:06:09.767414 IP 134.122.47.167.ssh > 81.68.90.168.54600: Flags [.], ack 526, win 507, options [nop,nop,TS val 1902276546 ecr 3875738834], length 0
02:06:10.001000 IP 81.68.90.168.54600 > 134.122.47.167.ssh: Flags [P.], seq 526:578, ack 1378, win 501, options [nop,nop,TS val 3875739067 ecr 1902276546], length 52
02:06:10.001037 IP 134.122.47.167.ssh > 81.68.90.168.54600: Flags [.], ack 578, win 507, options [nop,nop,TS val 1902276780 ecr 3875739067], length 0
02:06:10.001187 IP 134.122.47.167.ssh > 81.68.90.168.54600: Flags [P.], seq 1378:1430, ack 578, win 507, options [nop,nop,TS val 1902276780 ecr 3875739067], length 52
02:06:10.234737 IP 81.68.90.168.54600 > 134.122.47.167.ssh: Flags [P.], seq 578:662, ack 1430, win 501, options [nop,nop,TS val 3875739301 ecr 1902276780], length 84
02:06:10.275333 IP 134.122.47.167.ssh > 81.68.90.168.54600: Flags [.], ack 662, win 507, options [nop,nop,TS val 1902277054 ecr 3875739301], length 0
02:06:11.465203 IP 134.122.47.167.ssh > 221.181.185.198.27960: Flags [P.], seq 1554:1634, ack 1208, win 503, options [nop,nop,TS val 1363606681 ecr 8069293], length 80
02:06:11.766426 IP 221.181.185.198.27960 > 134.122.47.167.ssh: Flags [P.], seq 1208:1320, ack 1634, win 262, options [nop,nop,TS val 8070159 ecr 1363606681], length 112
02:06:11.766479 IP 134.122.47.167 > 221.181.185.198: ICMP 134.122.47.167 tcp port ssh unreachable, length 172
02:06:12.143318 IP 134.122.47.167.ssh > 221.181.185.198.27960: Flags [P.], seq 1554:1634, ack 1208, win 503, options [nop,nop,TS val 1363607359 ecr 8069293], length 80
02:06:12.354840 IP 221.181.185.198.27960 > 134.122.47.167.ssh: Flags [P.], seq 1208:1320, ack 1634, win 262, options [nop,nop,TS val 8070307 ecr 1363606681], length 112
02:06:12.354897 IP 134.122.47.167 > 221.181.185.198: ICMP 134.122.47.167 tcp port ssh unreachable, length 172
02:06:12.444579 IP 221.181.185.198.27960 > 134.122.47.167.ssh: Flags [.], ack 1634, win 262, options [nop,nop,TS val 8070329 ecr 1363607359,nop,nop,sack 1 {1554:1634}], length 0
02:06:12.444631 IP 134.122.47.167 > 221.181.185.198: ICMP 134.122.47.167 tcp port ssh unreachable, length 72
02:06:12.815351 IP 134.122.47.167.ssh > 221.181.185.198.27960: Flags [P.], seq 1554:1634, ack 1208, win 503, options [nop,nop,TS val 1363608031 ecr 8069293], length 80
02:06:13.116333 IP 221.181.185.198.27960 > 134.122.47.167.ssh: Flags [.], ack 1634, win 262, options [nop,nop,TS val 8070497 ecr 1363608031,nop,nop,sack 1 {1554:1634}], length 0
02:06:13.116384 IP 134.122.47.167 > 221.181.185.198: ICMP 134.122.47.167 tcp port ssh unreachable, length 72
02:06:13.399663 IP 134.122.47.167.ssh > 81.68.90.168.54600: Flags [P.], seq 1430:1498, ack 662, win 507, options [nop,nop,TS val 1902280178 ecr 3875739301], length 68
02:06:13.405183 IP 194.147.140.69.42487 > 134.122.47.167.35049: Flags [S], seq 952864433, win 1024, length 0
02:06:13.405219 IP 134.122.47.167.35049 > 194.147.140.69.42487: Flags [R.], seq 0, ack 952864434, win 0, length 0
02:06:13.518097 IP 194.147.140.69.42487 > 134.122.47.167.35049: Flags [R], seq 952864434, win 1200, length 0
02:06:13.967331 IP 134.122.47.167.ssh > 81.68.90.168.54600: Flags [P.], seq 1430:1498, ack 662, win 507, options [nop,nop,TS val 1902280746 ecr 3875739301], length 68
02:06:14.127333 IP 134.122.47.167.ssh > 221.181.185.198.27960: Flags [P.], seq 1554:1634, ack 1208, win 503, options [nop,nop,TS val 1363609343 ecr 8069293], length 80
02:06:14.130893 IP 221.181.185.198.27960 > 134.122.47.167.ssh: Flags [P.], seq 1208:1320, ack 1634, win 262, options [nop,nop,TS val 8070751 ecr 1363608031], length 112
02:06:14.130933 IP 134.122.47.167 > 221.181.185.198: ICMP 134.122.47.167 tcp port ssh unreachable, length 172
02:06:14.428296 IP 221.181.185.198.27960 > 134.122.47.167.ssh: Flags [.], ack 1634, win 262, options [nop,nop,TS val 8070825 ecr 1363609343,nop,nop,sack 1 {1554:1634}], length 0
02:06:14.428350 IP 134.122.47.167 > 221.181.185.198: ICMP 134.122.47.167 tcp port ssh unreachable, length 72
02:06:14.543333 IP 134.122.47.167.ssh > 81.68.90.168.54600: Flags [P.], seq 1430:1498, ack 662, win 507, options [nop,nop,TS val 1902281322 ecr 3875739301], length 68
02:06:14.776896 IP 81.68.90.168.54600 > 134.122.47.167.ssh: Flags [.], ack 1498, win 501, options [nop,nop,TS val 3875743843 ecr 1902281322,nop,nop,sack 1 {1430:1498}], length 0
02:06:15.041563 IP 81.68.90.168.54600 > 134.122.47.167.ssh: Flags [F.], seq 714, ack 1498, win 501, options [nop,nop,TS val 3875744108 ecr 1902281322], length 0
02:06:15.041595 IP 134.122.47.167.ssh > 81.68.90.168.54600: Flags [.], ack 662, win 507, options [nop,nop,TS val 1902281820 ecr 3875739301,nop,nop,sack 1 {714:715}], length 0
02:06:15.275287 IP 81.68.90.168.54600 > 134.122.47.167.ssh: Flags [P.], seq 662:714, ack 1498, win 501, options [nop,nop,TS val 3875744342 ecr 1902281820], length 52
02:06:15.275343 IP 134.122.47.167.ssh > 81.68.90.168.54600: Flags [.], ack 715, win 507, options [nop,nop,TS val 1902282054 ecr 3875744342], length 0
02:06:15.276689 IP 134.122.47.167.ssh > 81.68.90.168.54600: Flags [F.], seq 1498, ack 715, win 507, options [nop,nop,TS val 1902282055 ecr 3875744342], length 0
02:06:15.318800 IP 221.181.185.198.27960 > 134.122.47.167.ssh: Flags [P.], seq 1208:1320, ack 1634, win 262, options [nop,nop,TS val 8071048 ecr 1363609343], length 112
02:06:15.318839 IP 134.122.47.167 > 221.181.185.198: ICMP 134.122.47.167 tcp port ssh unreachable, length 172
02:06:15.510233 IP 81.68.90.168.54600 > 134.122.47.167.ssh: Flags [.], ack 1499, win 501, options [nop,nop,TS val 3875744577 ecr 1902282055], length 0
02:06:15.727337 IP 134.122.47.167.ssh > zg-1218a-206.stretchoid.com.50170: Flags [S.], seq 1105137355, ack 444518489, win 64240, options [mss 1460], length 0
02:06:16.503015 IP 212.64.65.2.45842 > 134.122.47.167.ssh: Flags [S], seq 2491279566, win 29200, options [mss 1424,sackOK,TS val 1625237263 ecr 0,nop,wscale 7], length 0
02:06:16.503061 IP 134.122.47.167.ssh > 212.64.65.2.45842: Flags [S.], seq 962860612, ack 2491279567, win 65160, options [mss 1460,sackOK,TS val 1088435575 ecr 1625237263,nop,wscale 7], length 0
02:06:16.751320 IP 134.122.47.167.ssh > 221.181.185.198.27960: Flags [P.], seq 1554:1634, ack 1208, win 503, options [nop,nop,TS val 1363611967 ecr 8069293], length 80
02:06:16.754654 IP 212.64.65.2.45842 > 134.122.47.167.ssh: Flags [.], ack 1, win 229, options [nop,nop,TS val 1625237515 ecr 1088435575], length 0
02:06:16.766630 IP 134.122.47.167.ssh > 212.64.65.2.45842: Flags [P.], seq 1:42, ack 1, win 510, options [nop,nop,TS val 1088435838 ecr 1625237515], length 41
02:06:17.021082 IP 212.64.65.2.45842 > 134.122.47.167.ssh: Flags [.], ack 42, win 229, options [nop,nop,TS val 1625237781 ecr 1088435838], length 0
02:06:17.022965 IP 212.64.65.2.45842 > 134.122.47.167.ssh: Flags [P.], seq 1:22, ack 42, win 229, options [nop,nop,TS val 1625237783 ecr 1088435838], length 21
02:06:17.022996 IP 134.122.47.167.ssh > 212.64.65.2.45842: Flags [.], ack 22, win 510, options [nop,nop,TS val 1088436095 ecr 1625237783], length 0
02:06:17.024800 IP 134.122.47.167.ssh > 212.64.65.2.45842: Flags [P.], seq 42:1098, ack 22, win 510, options [nop,nop,TS val 1088436096 ecr 1625237783], length 1056
02:06:17.052431 IP 221.181.185.198.27960 > 134.122.47.167.ssh: Flags [.], ack 1634, win 262, options [nop,nop,TS val 8071481 ecr 1363611967,nop,nop,sack 1 {1554:1634}], length 0
02:06:17.052480 IP 134.122.47.167 > 221.181.185.198: ICMP 134.122.47.167 tcp port ssh unreachable, length 72
02:06:17.694834 IP 221.181.185.198.27960 > 134.122.47.167.ssh: Flags [P.], seq 1208:1320, ack 1634, win 262, options [nop,nop,TS val 8071642 ecr 1363611967], length 112
02:06:17.694890 IP 134.122.47.167 > 221.181.185.198: ICMP 134.122.47.167 tcp port ssh unreachable, length 172
02:06:17.743339 IP 134.122.47.167.ssh > 212.64.65.2.45842: Flags [P.], seq 42:1098, ack 22, win 510, options [nop,nop,TS val 1088436815 ecr 1625237783], length 1056
02:06:17.861644 IP 212.64.65.2.45842 > 134.122.47.167.ssh: Flags [P.], seq 462:510, ack 1098, win 245, options [nop,nop,TS val 1625238622 ecr 1088436096], length 48
02:06:17.861691 IP 134.122.47.167.ssh > 212.64.65.2.45842: Flags [.], ack 22, win 510, options [nop,nop,TS val 1088436933 ecr 1625237783,nop,nop,sack 1 {462:510}], length 0
02:06:17.994956 IP 212.64.65.2.45842 > 134.122.47.167.ssh: Flags [.], ack 1098, win 245, options [nop,nop,TS val 1625238755 ecr 1088436815,nop,nop,sack 1 {42:1098}], length 0
02:06:18.113741 IP 212.64.65.2.45842 > 134.122.47.167.ssh: Flags [P.], seq 22:462, ack 1098, win 245, options [nop,nop,TS val 1625238874 ecr 1088436933], length 440
02:06:18.113835 IP 134.122.47.167.ssh > 212.64.65.2.45842: Flags [.], ack 510, win 507, options [nop,nop,TS val 1088437185 ecr 1625238874], length 0
02:06:18.123070 IP 134.122.47.167.ssh > 212.64.65.2.45842: Flags [P.], seq 1098:1378, ack 510, win 507, options [nop,nop,TS val 1088437195 ecr 1625238874], length 280
02:06:18.376920 IP 212.64.65.2.45842 > 134.122.47.167.ssh: Flags [.], ack 1378, win 262, options [nop,nop,TS val 1625239137 ecr 1088437195], length 0
02:06:18.381583 IP 212.64.65.2.45842 > 134.122.47.167.ssh: Flags [P.], seq 510:526, ack 1378, win 262, options [nop,nop,TS val 1625239141 ecr 1088437195], length 16
02:06:18.381623 IP 134.122.47.167.ssh > 212.64.65.2.45842: Flags [.], ack 526, win 507, options [nop,nop,TS val 1088437453 ecr 1625239141], length 0
02:06:18.633124 IP 212.64.65.2.45842 > 134.122.47.167.ssh: Flags [P.], seq 526:578, ack 1378, win 262, options [nop,nop,TS val 1625239393 ecr 1088437453], length 52
02:06:18.633166 IP 134.122.47.167.ssh > 212.64.65.2.45842: Flags [.], ack 578, win 507, options [nop,nop,TS val 1088437705 ecr 1625239393], length 0
02:06:18.633330 IP 134.122.47.167.ssh > 212.64.65.2.45842: Flags [P.], seq 1378:1430, ack 578, win 507, options [nop,nop,TS val 1088437705 ecr 1625239393], length 52
02:06:18.715360 IP 195.54.161.150.55164 > 134.122.47.167.11333: Flags [S], seq 2309247852, win 1024, length 0
02:06:18.715404 IP 134.122.47.167.11333 > 195.54.161.150.55164: Flags [R.], seq 0, ack 2309247853, win 0, length 0
02:06:18.858396 IP 195.54.161.150.55164 > 134.122.47.167.11333: Flags [R], seq 2309247853, win 1200, length 0
02:06:18.892224 IP 212.64.65.2.45842 > 134.122.47.167.ssh: Flags [P.], seq 578:662, ack 1430, win 262, options [nop,nop,TS val 1625239652 ecr 1088437705], length 84
02:06:18.935345 IP 134.122.47.167.ssh > 212.64.65.2.45842: Flags [.], ack 662, win 507, options [nop,nop,TS val 1088438007 ecr 1625239652], length 0
02:06:20.311778 IP 132.ip-51-91-123.eu.52014 > 134.122.47.167.ssh: Flags [S], seq 4020840593, win 64240, options [mss 1460,sackOK,TS val 3714430417 ecr 0,nop,wscale 7], length 0
02:06:20.311827 IP 134.122.47.167 > 132.ip-51-91-123.eu: ICMP 134.122.47.167 tcp port ssh unreachable, length 68
02:06:21.775754 IP 221.181.185.198.27960 > 134.122.47.167.ssh: Flags [FP.], seq 1320:1384, ack 1634, win 262, options [nop,nop,TS val 8072662 ecr 1363611967], length 64
02:06:21.775796 IP 134.122.47.167 > 221.181.185.198: ICMP 134.122.47.167 tcp port ssh unreachable, length 124
02:06:21.776375 IP 221.181.185.198.12992 > 134.122.47.167.ssh: Flags [S], seq 834359848, win 29200, options [mss 1460,sackOK,TS val 8072662 ecr 0,nop,wscale 7], length 0
02:06:21.776387 IP 134.122.47.167 > 221.181.185.198: ICMP 134.122.47.167 tcp port ssh unreachable, length 68
02:06:22.057117 IP 134.122.47.167.ssh > 212.64.65.2.45842: Flags [P.], seq 1430:1498, ack 662, win 507, options [nop,nop,TS val 1088441129 ecr 1625239652], length 68
02:06:22.076347 IP 221.181.185.198.14538 > 134.122.47.167.ssh: Flags [S], seq 3977490861, win 29200, options [mss 1460,sackOK,TS val 8072737 ecr 0,nop,wscale 7], length 0
02:06:22.076385 IP 134.122.47.167 > 221.181.185.198: ICMP 134.122.47.167 tcp port ssh unreachable, length 68
02:06:22.127355 IP 134.122.47.167.ssh > 221.181.185.198.27960: Flags [P.], seq 1554:1634, ack 1208, win 503, options [nop,nop,TS val 1363617343 ecr 8069293], length 80
02:06:22.317362 IP 212.64.65.2.45842 > 134.122.47.167.ssh: Flags [P.], seq 662:714, ack 1498, win 262, options [nop,nop,TS val 1625243077 ecr 1088441129], length 52
02:06:22.317397 IP 134.122.47.167.ssh > 212.64.65.2.45842: Flags [.], ack 714, win 507, options [nop,nop,TS val 1088441389 ecr 1625243077], length 0
02:06:22.317421 IP 212.64.65.2.45842 > 134.122.47.167.ssh: Flags [F.], seq 714, ack 1498, win 262, options [nop,nop,TS val 1625243077 ecr 1088441129], length 0
02:06:22.319157 IP 134.122.47.167.ssh > 212.64.65.2.45842: Flags [F.], seq 1498, ack 715, win 507, options [nop,nop,TS val 1088441391 ecr 1625243077], length 0
02:06:22.372594 IP 221.181.185.198.16498 > 134.122.47.167.ssh: Flags [S], seq 3451792051, win 29200, options [mss 1460,sackOK,TS val 8072812 ecr 0,nop,wscale 7], length 0
02:06:22.372633 IP 134.122.47.167 > 221.181.185.198: ICMP 134.122.47.167 tcp port ssh unreachable, length 68
02:06:22.428453 IP 221.181.185.198.27960 > 134.122.47.167.ssh: Flags [.], ack 1634, win 262, options [nop,nop,TS val 8072825 ecr 1363617343,nop,nop,sack 1 {1554:1634}], length 0
02:06:22.428491 IP 134.122.47.167 > 221.181.185.198: ICMP 134.122.47.167 tcp port ssh unreachable, length 72
02:06:23.109687 IP 212.64.65.2.45842 > 134.122.47.167.ssh: Flags [F.], seq 714, ack 1498, win 262, options [nop,nop,TS val 1625243870 ecr 1088441389], length 0
02:06:23.109730 IP 134.122.47.167.ssh > 212.64.65.2.45842: Flags [.], ack 715, win 507, options [nop,nop,TS val 1088442181 ecr 1625243870,nop,nop,sack 1 {714:715}], length 0
02:06:23.151306 IP 134.122.47.167.ssh > 212.64.65.2.45842: Flags [F.], seq 1498, ack 715, win 507, options [nop,nop,TS val 1088442223 ecr 1625243870], length 0
02:06:23.406101 IP 212.64.65.2.45842 > 134.122.47.167.ssh: Flags [.], ack 1499, win 262, options [nop,nop,TS val 1625244166 ecr 1088442223], length 0
02:06:25.925138 IP 139.155.30.115.38734 > 134.122.47.167.ssh: Flags [S], seq 451567157, win 29200, options [mss 1424,sackOK,TS val 3744392901 ecr 0,nop,wscale 7], length 0
02:06:25.925185 IP 134.122.47.167 > 139.155.30.115: ICMP 134.122.47.167 tcp port ssh unreachable, length 68
