root@lamp-ubuntu-s-1vcpu-1gb-tor1-01:~# tcpdump -n -i eth0 -c 5
tcpdump: verbose output suppressed, use -v or -vv for full protocol decode
listening on eth0, link-type EN10MB (Ethernet), capture size 262144 bytes
02:08:16.920062 IP 134.122.47.167.22 > 38.64.227.143.56749: Flags [P.], seq 3065720002:3065720110, ack 2778202675, win 501, length 108
02:08:16.920151 IP 134.122.47.167.22 > 38.64.227.143.56749: Flags [P.], seq 108:144, ack 1, win 501, length 36
02:08:16.920234 IP 134.122.47.167.22 > 38.64.227.143.56749: Flags [P.], seq 144:252, ack 1, win 501, length 108
02:08:16.920327 IP 134.122.47.167.22 > 38.64.227.143.56749: Flags [P.], seq 252:288, ack 1, win 501, length 36
02:08:16.920482 IP 134.122.47.167.22 > 38.64.227.143.56749: Flags [P.], seq 288:460, ack 1, win 501, length 172
5 packets captured
9 packets received by filter
0 packets dropped by kernel
