root@lamp-ubuntu-s-1vcpu-1gb-tor1-01:~# tcpdump -i eth0 tcp -c 5
tcpdump: verbose output suppressed, use -v or -vv for full protocol decode
listening on eth0, link-type EN10MB (Ethernet), capture size 262144 bytes
02:09:52.308452 IP 134.122.47.167.ssh > 38.64.227.143.56749: Flags [P.], seq 3067860478:3067860514, ack 2778207183, win 501, length 36
02:09:52.310195 IP 134.122.47.167.ssh > 38.64.227.143.56749: Flags [P.], seq 36:144, ack 1, win 501, length 108
02:09:52.310271 IP 134.122.47.167.ssh > 38.64.227.143.56749: Flags [P.], seq 144:180, ack 1, win 501, length 36
02:09:52.310333 IP 134.122.47.167.ssh > 38.64.227.143.56749: Flags [P.], seq 180:288, ack 1, win 501, length 108
02:09:52.310374 IP 134.122.47.167.ssh > 38.64.227.143.56749: Flags [P.], seq 288:324, ack 1, win 501, length 36
5 packets captured
18 packets received by filter
0 packets dropped by kernel
