root@lamp-ubuntu-s-1vcpu-1gb-tor1-01:~# tcpdump -i eth0
tcpdump: verbose output suppressed, use -v or -vv for full protocol decode
listening on eth0, link-type EN10MB (Ethernet), capture size 262144 bytes
01:57:33.288585 IP 134.122.47.167.ssh > 38.64.227.143.56749: Flags [P.], seq 3059633562:3059633670, ack 2778191803, win 501, length 108
01:57:33.288670 IP 134.122.47.167.ssh > 38.64.227.143.56749: Flags [P.], seq 108:144, ack 1, win 501, length 36
01:57:33.288733 IP 134.122.47.167.ssh > 38.64.227.143.56749: Flags [P.], seq 144:252, ack 1, win 501, length 108
01:57:33.288784 IP 134.122.47.167.ssh > 38.64.227.143.56749: Flags [P.], seq 252:288, ack 1, win 501, length 36
01:57:33.289213 IP 134.122.47.167.35256 > dns.google.domain: 637+ PTR? 143.227.64.38.in-addr.arpa. (44)
01:57:33.297612 IP dns.google.domain > 134.122.47.167.35256: 637 ServFail 0/0/0 (44)
01:57:33.297806 IP 134.122.47.167.46911 > dns.google.domain: 637+ PTR? 143.227.64.38.in-addr.arpa. (44)
01:57:33.305859 IP dns.google.domain > 134.122.47.167.46911: 637 ServFail 0/0/0 (44)
01:57:33.306104 IP 134.122.47.167.58821 > dns.google.domain: 24963+ PTR? 167.47.122.134.in-addr.arpa. (45)
01:57:33.310431 IP 38.64.227.143.56749 > 134.122.47.167.ssh: Flags [.], ack 252, win 509, length 0
01:57:33.314010 IP dns.google.domain > 134.122.47.167.58821: 24963 NXDomain 0/1/0 (112)
01:57:33.314231 IP 134.122.47.167.ssh > 38.64.227.143.56749: Flags [P.], seq 288:460, ack 1, win 501, length 172
01:57:33.314344 IP 134.122.47.167.ssh > 38.64.227.143.56749: Flags [P.], seq 460:496, ack 1, win 501, length 36
01:57:33.314392 IP 134.122.47.167.ssh > 38.64.227.143.56749: Flags [P.], seq 496:644, ack 1, win 501, length 148
01:57:33.314443 IP 134.122.47.167.ssh > 38.64.227.143.56749: Flags [P.], seq 644:680, ack 1, win 501, length 36
01:57:33.314522 IP 134.122.47.167.ssh > 38.64.227.143.56749: Flags [P.], seq 680:828, ack 1, win 501, length 148
01:57:33.314572 IP 134.122.47.167.ssh > 38.64.227.143.56749: Flags [P.], seq 828:864, ack 1, win 501, length 36
01:57:33.314635 IP 134.122.47.167.ssh > 38.64.227.143.56749: Flags [P.], seq 864:1012, ack 1, win 501, length 148
01:57:33.314686 IP 134.122.47.167.ssh > 38.64.227.143.56749: Flags [P.], seq 1012:1048, ack 1, win 501, length 36
01:57:33.314819 IP 134.122.47.167.47257 > dns.google.domain: 61224+ PTR? 8.8.8.8.in-addr.arpa. (38)
01:57:33.315407 IP dns.google.domain > 134.122.47.167.47257: 61224 1/0/0 PTR dns.google. (62)
01:57:33.315505 IP 134.122.47.167.ssh > 38.64.227.143.56749: Flags [P.], seq 1048:1188, ack 1, win 501, length 140
01:57:33.332754 IP 38.64.227.143.56749 > 134.122.47.167.ssh: Flags [.], ack 1188, win 511, length 0
01:57:33.332808 IP 134.122.47.167.ssh > 38.64.227.143.56749: Flags [P.], seq 1188:4108, ack 1, win 501, length 2920
01:57:33.332919 IP 134.122.47.167.ssh > 38.64.227.143.56749: Flags [P.], seq 4108:4224, ack 1, win 501, length 116
01:57:33.332994 IP 134.122.47.167.ssh > 38.64.227.143.56749: Flags [P.], seq 4224:4364, ack 1, win 501, length 140
01:57:33.333041 IP 134.122.47.167.ssh > 38.64.227.143.56749: Flags [P.], seq 4364:4400, ack 1, win 501, length 36
01:57:33.333089 IP 134.122.47.167.ssh > 38.64.227.143.56749: Flags [P.], seq 4400:4556, ack 1, win 501, length 156
01:57:33.333123 IP 134.122.47.167.ssh > 38.64.227.143.56749: Flags [P.], seq 4556:4592, ack 1, win 501, length 36
01:57:33.333172 IP 134.122.47.167.ssh > 38.64.227.143.56749: Flags [P.], seq 4592:4740, ack 1, win 501, length 148
01:57:33.333248 IP 134.122.47.167.ssh > 38.64.227.143.56749: Flags [P.], seq 4740:4776, ack 1, win 501, length 36
01:57:33.333311 IP 134.122.47.167.ssh > 38.64.227.143.56749: Flags [P.], seq 4776:4924, ack 1, win 501, length 148
01:57:33.333351 IP 134.122.47.167.ssh > 38.64.227.143.56749: Flags [P.], seq 4924:4960, ack 1, win 501, length 36
01:57:33.333408 IP 134.122.47.167.ssh > 38.64.227.143.56749: Flags [P.], seq 4960:5108, ack 1, win 501, length 148
01:57:33.333447 IP 134.122.47.167.ssh > 38.64.227.143.56749: Flags [P.], seq 5108:5144, ack 1, win 501, length 36
01:57:33.333494 IP 134.122.47.167.ssh > 38.64.227.143.56749: Flags [P.], seq 5144:5292, ack 1, win 501, length 148
01:57:33.333552 IP 134.122.47.167.ssh > 38.64.227.143.56749: Flags [P.], seq 5292:5476, ack 1, win 501, length 184
01:57:33.333593 IP 134.122.47.167.ssh > 38.64.227.143.56749: Flags [P.], seq 5476:5512, ack 1, win 501, length 36
01:57:33.333640 IP 134.122.47.167.ssh > 38.64.227.143.56749: Flags [P.], seq 5512:5660, ack 1, win 501, length 148
01:57:33.333679 IP 134.122.47.167.ssh > 38.64.227.143.56749: Flags [P.], seq 5660:5696, ack 1, win 501, length 36
01:57:33.333725 IP 134.122.47.167.ssh > 38.64.227.143.56749: Flags [P.], seq 5696:5844, ack 1, win 501, length 148
01:57:33.333764 IP 134.122.47.167.ssh > 38.64.227.143.56749: Flags [P.], seq 5844:5880, ack 1, win 501, length 36
01:57:33.353194 IP 38.64.227.143.56749 > 134.122.47.167.ssh: Flags [.], ack 4924, win 510, length 0
01:57:33.353255 IP 134.122.47.167.ssh > 38.64.227.143.56749: Flags [P.], seq 5880:7904, ack 1, win 501, length 2024
01:57:33.353275 IP 38.64.227.143.56749 > 134.122.47.167.ssh: Flags [.], ack 5880, win 512, length 0
01:57:33.353436 IP 134.122.47.167.ssh > 38.64.227.143.56749: Flags [P.], seq 7904:8044, ack 1, win 501, length 140
01:57:33.353494 IP 134.122.47.167.ssh > 38.64.227.143.56749: Flags [P.], seq 8044:8080, ack 1, win 501, length 36
01:57:33.353552 IP 134.122.47.167.ssh > 38.64.227.143.56749: Flags [P.], seq 8080:8236, ack 1, win 501, length 156
01:57:33.353599 IP 134.122.47.167.ssh > 38.64.227.143.56749: Flags [P.], seq 8236:8272, ack 1, win 501, length 36
01:57:33.353656 IP 134.122.47.167.ssh > 38.64.227.143.56749: Flags [P.], seq 8272:8412, ack 1, win 501, length 140
01:57:33.353706 IP 134.122.47.167.ssh > 38.64.227.143.56749: Flags [P.], seq 8412:8448, ack 1, win 501, length 36
01:57:33.353774 IP 134.122.47.167.ssh > 38.64.227.143.56749: Flags [P.], seq 8448:8596, ack 1, win 501, length 148
01:57:33.353832 IP 134.122.47.167.ssh > 38.64.227.143.56749: Flags [P.], seq 8596:8632, ack 1, win 501, length 36
01:57:33.353887 IP 134.122.47.167.ssh > 38.64.227.143.56749: Flags [P.], seq 8632:8780, ack 1, win 501, length 148
01:57:33.353934 IP 134.122.47.167.ssh > 38.64.227.143.56749: Flags [P.], seq 8780:8816, ack 1, win 501, length 36
01:57:33.353991 IP 134.122.47.167.ssh > 38.64.227.143.56749: Flags [P.], seq 8816:8964, ack 1, win 501, length 148
01:57:33.354091 IP 134.122.47.167.ssh > 38.64.227.143.56749: Flags [P.], seq 8964:9148, ack 1, win 501, length 184
01:57:33.354191 IP 134.122.47.167.ssh > 38.64.227.143.56749: Flags [P.], seq 9148:9184, ack 1, win 501, length 36
01:57:33.354237 IP 134.122.47.167.ssh > 38.64.227.143.56749: Flags [P.], seq 9184:9332, ack 1, win 501, length 148
01:57:33.354285 IP 134.122.47.167.ssh > 38.64.227.143.56749: Flags [P.], seq 9332:9368, ack 1, win 501, length 36
01:57:33.354339 IP 134.122.47.167.ssh > 38.64.227.143.56749: Flags [P.], seq 9368:9516, ack 1, win 501, length 148
01:57:33.354378 IP 134.122.47.167.ssh > 38.64.227.143.56749: Flags [P.], seq 9516:9552, ack 1, win 501, length 36
01:57:33.354425 IP 134.122.47.167.ssh > 38.64.227.143.56749: Flags [P.], seq 9552:9700, ack 1, win 501, length 148
01:57:33.354463 IP 134.122.47.167.ssh > 38.64.227.143.56749: Flags [P.], seq 9700:9736, ack 1, win 501, length 36
01:57:33.354509 IP 134.122.47.167.ssh > 38.64.227.143.56749: Flags [P.], seq 9736:9884, ack 1, win 501, length 148
01:57:33.354548 IP 134.122.47.167.ssh > 38.64.227.143.56749: Flags [P.], seq 9884:9920, ack 1, win 501, length 36
01:57:33.354596 IP 134.122.47.167.ssh > 38.64.227.143.56749: Flags [P.], seq 9920:10068, ack 1, win 501, length 148
01:57:33.354635 IP 134.122.47.167.ssh > 38.64.227.143.56749: Flags [P.], seq 10068:10104, ack 1, win 501, length 36
01:57:33.354684 IP 134.122.47.167.ssh > 38.64.227.143.56749: Flags [P.], seq 10104:10252, ack 1, win 501, length 148
01:57:33.354742 IP 134.122.47.167.ssh > 38.64.227.143.56749: Flags [P.], seq 10252:10288, ack 1, win 501, length 36
01:57:33.354799 IP 134.122.47.167.ssh > 38.64.227.143.56749: Flags [P.], seq 10288:10436, ack 1, win 501, length 148
01:57:33.354867 IP 134.122.47.167.ssh > 38.64.227.143.56749: Flags [P.], seq 10436:10472, ack 1, win 501, length 36
01:57:33.354919 IP 134.122.47.167.ssh > 38.64.227.143.56749: Flags [P.], seq 10472:10620, ack 1, win 501, length 148
01:57:33.354975 IP 134.122.47.167.ssh > 38.64.227.143.56749: Flags [P.], seq 10620:10656, ack 1, win 501, length 36
01:57:33.355027 IP 134.122.47.167.ssh > 38.64.227.143.56749: Flags [P.], seq 10656:10804, ack 1, win 501, length 148
01:57:33.355067 IP 134.122.47.167.ssh > 38.64.227.143.56749: Flags [P.], seq 10804:10840, ack 1, win 501, length 36
01:57:33.355114 IP 134.122.47.167.ssh > 38.64.227.143.56749: Flags [P.], seq 10840:10988, ack 1, win 501, length 148
01:57:33.355152 IP 134.122.47.167.ssh > 38.64.227.143.56749: Flags [P.], seq 10988:11024, ack 1, win 501, length 36
01:57:33.355200 IP 134.122.47.167.ssh > 38.64.227.143.56749: Flags [P.], seq 11024:11172, ack 1, win 501, length 148
01:57:33.355237 IP 134.122.47.167.ssh > 38.64.227.143.56749: Flags [P.], seq 11172:11208, ack 1, win 501, length 36
01:57:33.355303 IP 134.122.47.167.ssh > 38.64.227.143.56749: Flags [P.], seq 11208:11356, ack 1, win 501, length 148
01:57:33.355349 IP 134.122.47.167.ssh > 38.64.227.143.56749: Flags [P.], seq 11356:11392, ack 1, win 501, length 36
01:57:33.355397 IP 134.122.47.167.ssh > 38.64.227.143.56749: Flags [P.], seq 11392:11540, ack 1, win 501, length 148
01:57:33.404504 IP 38.64.227.143.56749 > 134.122.47.167.ssh: Flags [.], ack 8816, win 509, length 0
01:57:33.404614 IP 134.122.47.167.ssh > 38.64.227.143.56749: Flags [P.], seq 11540:14460, ack 1, win 501, length 2920
01:57:33.404636 IP 134.122.47.167.ssh > 38.64.227.143.56749: Flags [P.], seq 14460:15576, ack 1, win 501, length 1116
01:57:33.404646 IP 38.64.227.143.56749 > 134.122.47.167.ssh: Flags [.], ack 10252, win 510, length 0
01:57:33.404668 IP 38.64.227.143.56749 > 134.122.47.167.ssh: Flags [.], ack 11540, win 511, length 0
01:57:33.404925 IP 134.122.47.167.ssh > 38.64.227.143.56749: Flags [P.], seq 15576:15716, ack 1, win 501, length 140
01:57:33.405000 IP 134.122.47.167.ssh > 38.64.227.143.56749: Flags [P.], seq 15716:15752, ack 1, win 501, length 36
01:57:33.405059 IP 134.122.47.167.ssh > 38.64.227.143.56749: Flags [P.], seq 15752:15908, ack 1, win 501, length 156
01:57:33.405100 IP 134.122.47.167.ssh > 38.64.227.143.56749: Flags [P.], seq 15908:15944, ack 1, win 501, length 36
01:57:33.405156 IP 134.122.47.167.ssh > 38.64.227.143.56749: Flags [P.], seq 15944:16100, ack 1, win 501, length 156
01:57:33.405241 IP 134.122.47.167.ssh > 38.64.227.143.56749: Flags [P.], seq 16100:16136, ack 1, win 501, length 36
01:57:33.405322 IP 134.122.47.167.ssh > 38.64.227.143.56749: Flags [P.], seq 16136:16276, ack 1, win 501, length 140
01:57:33.405387 IP 134.122.47.167.ssh > 38.64.227.143.56749: Flags [P.], seq 16276:16312, ack 1, win 501, length 36
01:57:33.405462 IP 134.122.47.167.ssh > 38.64.227.143.56749: Flags [P.], seq 16312:16452, ack 1, win 501, length 140
01:57:33.405537 IP 134.122.47.167.ssh > 38.64.227.143.56749: Flags [P.], seq 16452:16488, ack 1, win 501, length 36
01:57:33.405592 IP 134.122.47.167.ssh > 38.64.227.143.56749: Flags [P.], seq 16488:16644, ack 1, win 501, length 156
01:57:33.405632 IP 134.122.47.167.ssh > 38.64.227.143.56749: Flags [P.], seq 16644:16680, ack 1, win 501, length 36
01:57:33.405678 IP 134.122.47.167.ssh > 38.64.227.143.56749: Flags [P.], seq 16680:16836, ack 1, win 501, length 156
01:57:33.405716 IP 134.122.47.167.ssh > 38.64.227.143.56749: Flags [P.], seq 16836:16872, ack 1, win 501, length 36
01:57:33.405763 IP 134.122.47.167.ssh > 38.64.227.143.56749: Flags [P.], seq 16872:17028, ack 1, win 501, length 156
01:57:33.405801 IP 134.122.47.167.ssh > 38.64.227.143.56749: Flags [P.], seq 17028:17064, ack 1, win 501, length 36
01:57:33.405847 IP 134.122.47.167.ssh > 38.64.227.143.56749: Flags [P.], seq 17064:17220, ack 1, win 501, length 156
01:57:33.405885 IP 134.122.47.167.ssh > 38.64.227.143.56749: Flags [P.], seq 17220:17256, ack 1, win 501, length 36
01:57:33.405931 IP 134.122.47.167.ssh > 38.64.227.143.56749: Flags [P.], seq 17256:17412, ack 1, win 501, length 156
01:57:33.405969 IP 134.122.47.167.ssh > 38.64.227.143.56749: Flags [P.], seq 17412:17448, ack 1, win 501, length 36
01:57:33.406014 IP 134.122.47.167.ssh > 38.64.227.143.56749: Flags [P.], seq 17448:17604, ack 1, win 501, length 156
01:57:33.406051 IP 134.122.47.167.ssh > 38.64.227.143.56749: Flags [P.], seq 17604:17640, ack 1, win 501, length 36
01:57:33.406097 IP 134.122.47.167.ssh > 38.64.227.143.56749: Flags [P.], seq 17640:17796, ack 1, win 501, length 156
01:57:33.406133 IP 134.122.47.167.ssh > 38.64.227.143.56749: Flags [P.], seq 17796:17832, ack 1, win 501, length 36
01:57:33.406180 IP 134.122.47.167.ssh > 38.64.227.143.56749: Flags [P.], seq 17832:17988, ack 1, win 501, length 156
01:57:33.406217 IP 134.122.47.167.ssh > 38.64.227.143.56749: Flags [P.], seq 17988:18024, ack 1, win 501, length 36
01:57:33.406256 IP 134.122.47.167.ssh > 38.64.227.143.56749: Flags [P.], seq 18024:18180, ack 1, win 501, length 156
01:57:33.406294 IP 134.122.47.167.ssh > 38.64.227.143.56749: Flags [P.], seq 18180:18216, ack 1, win 501, length 36
01:57:33.406337 IP 134.122.47.167.ssh > 38.64.227.143.56749: Flags [P.], seq 18216:18372, ack 1, win 501, length 156
01:57:33.406379 IP 134.122.47.167.ssh > 38.64.227.143.56749: Flags [P.], seq 18372:18408, ack 1, win 501, length 36
01:57:33.406425 IP 134.122.47.167.ssh > 38.64.227.143.56749: Flags [P.], seq 18408:18564, ack 1, win 501, length 156
01:57:33.406482 IP 134.122.47.167.ssh > 38.64.227.143.56749: Flags [P.], seq 18564:18756, ack 1, win 501, length 192
01:57:33.406518 IP 134.122.47.167.ssh > 38.64.227.143.56749: Flags [P.], seq 18756:18792, ack 1, win 501, length 36
01:57:33.406566 IP 134.122.47.167.ssh > 38.64.227.143.56749: Flags [P.], seq 18792:18948, ack 1, win 501, length 156
01:57:33.406601 IP 134.122.47.167.ssh > 38.64.227.143.56749: Flags [P.], seq 18948:18984, ack 1, win 501, length 36
01:57:33.406646 IP 134.122.47.167.ssh > 38.64.227.143.56749: Flags [P.], seq 18984:19140, ack 1, win 501, length 156
01:57:33.406682 IP 134.122.47.167.ssh > 38.64.227.143.56749: Flags [P.], seq 19140:19176, ack 1, win 501, length 36
01:57:33.406728 IP 134.122.47.167.ssh > 38.64.227.143.56749: Flags [P.], seq 19176:19332, ack 1, win 501, length 156
01:57:33.406765 IP 134.122.47.167.ssh > 38.64.227.143.56749: Flags [P.], seq 19332:19368, ack 1, win 501, length 36
01:57:33.406811 IP 134.122.47.167.ssh > 38.64.227.143.56749: Flags [P.], seq 19368:19524, ack 1, win 501, length 156
01:57:33.406848 IP 134.122.47.167.ssh > 38.64.227.143.56749: Flags [P.], seq 19524:19560, ack 1, win 501, length 36
01:57:33.406894 IP 134.122.47.167.ssh > 38.64.227.143.56749: Flags [P.], seq 19560:19716, ack 1, win 501, length 156
01:57:33.406933 IP 134.122.47.167.ssh > 38.64.227.143.56749: Flags [P.], seq 19716:19752, ack 1, win 501, length 36
01:57:33.406996 IP 134.122.47.167.ssh > 38.64.227.143.56749: Flags [P.], seq 19752:19908, ack 1, win 501, length 156
01:57:33.407064 IP 134.122.47.167.ssh > 38.64.227.143.56749: Flags [P.], seq 19908:19944, ack 1, win 501, length 36
01:57:33.407077 IP 134.122.47.167.ssh > 38.64.227.143.56749: Flags [P.], seq 19944:20100, ack 1, win 501, length 156
01:57:33.407160 IP 134.122.47.167.ssh > 38.64.227.143.56749: Flags [P.], seq 20100:20136, ack 1, win 501, length 36
01:57:33.407206 IP 134.122.47.167.ssh > 38.64.227.143.56749: Flags [P.], seq 20136:20292, ack 1, win 501, length 156
01:57:33.407288 IP 134.122.47.167.ssh > 38.64.227.143.56749: Flags [P.], seq 20292:20328, ack 1, win 501, length 36
01:57:33.407355 IP 134.122.47.167.ssh > 38.64.227.143.56749: Flags [P.], seq 20328:20484, ack 1, win 501, length 156
01:57:33.407409 IP 134.122.47.167.ssh > 38.64.227.143.56749: Flags [P.], seq 20484:20520, ack 1, win 501, length 36
01:57:33.407457 IP 134.122.47.167.ssh > 38.64.227.143.56749: Flags [P.], seq 20520:20676, ack 1, win 501, length 156
01:57:33.407529 IP 134.122.47.167.ssh > 38.64.227.143.56749: Flags [P.], seq 20676:21064, ack 1, win 501, length 388
01:57:33.407606 IP 134.122.47.167.ssh > 38.64.227.143.56749: Flags [P.], seq 21064:21572, ack 1, win 501, length 508
01:57:33.407693 IP 134.122.47.167.ssh > 38.64.227.143.56749: Flags [P.], seq 21572:21728, ack 1, win 501, length 156
01:57:33.407810 IP 134.122.47.167.ssh > 38.64.227.143.56749: Flags [P.], seq 21728:22588, ack 1, win 501, length 860
01:57:33.407897 IP 134.122.47.167.ssh > 38.64.227.143.56749: Flags [P.], seq 22588:23216, ack 1, win 501, length 628
01:57:33.407975 IP 134.122.47.167.ssh > 38.64.227.143.56749: Flags [P.], seq 23216:23724, ack 1, win 501, length 508
01:57:33.408050 IP 134.122.47.167.ssh > 38.64.227.143.56749: Flags [P.], seq 23724:24232, ack 1, win 501, length 508
01:57:33.408136 IP 134.122.47.167.ssh > 38.64.227.143.56749: Flags [P.], seq 24232:24860, ack 1, win 501, length 628
01:57:33.408212 IP 134.122.47.167.ssh > 38.64.227.143.56749: Flags [P.], seq 24860:25368, ack 1, win 501, length 508
01:57:33.408281 IP 134.122.47.167.ssh > 38.64.227.143.56749: Flags [P.], seq 25368:25644, ack 1, win 501, length 276
01:57:33.408368 IP 134.122.47.167.ssh > 38.64.227.143.56749: Flags [P.], seq 25644:25800, ack 1, win 501, length 156
01:57:33.408430 IP 134.122.47.167.ssh > 38.64.227.143.56749: Flags [P.], seq 25800:25956, ack 1, win 501, length 156
01:57:33.408529 IP 134.122.47.167.ssh > 38.64.227.143.56749: Flags [P.], seq 25956:26112, ack 1, win 501, length 156
01:57:33.408646 IP 134.122.47.167.ssh > 38.64.227.143.56749: Flags [P.], seq 26112:26268, ack 1, win 501, length 156
01:57:33.408741 IP 134.122.47.167.ssh > 38.64.227.143.56749: Flags [P.], seq 26268:26424, ack 1, win 501, length 156
01:57:33.408826 IP 134.122.47.167.ssh > 38.64.227.143.56749: Flags [P.], seq 26424:26580, ack 1, win 501, length 156
01:57:33.408898 IP 134.122.47.167.ssh > 38.64.227.143.56749: Flags [P.], seq 26580:26736, ack 1, win 501, length 156
01:57:33.408956 IP 134.122.47.167.ssh > 38.64.227.143.56749: Flags [P.], seq 26736:26892, ack 1, win 501, length 156
01:57:33.409012 IP 134.122.47.167.ssh > 38.64.227.143.56749: Flags [P.], seq 26892:27048, ack 1, win 501, length 156
01:57:33.409067 IP 134.122.47.167.ssh > 38.64.227.143.56749: Flags [P.], seq 27048:27204, ack 1, win 501, length 156
01:57:33.409122 IP 134.122.47.167.ssh > 38.64.227.143.56749: Flags [P.], seq 27204:27360, ack 1, win 501, length 156
01:57:33.409177 IP 134.122.47.167.ssh > 38.64.227.143.56749: Flags [P.], seq 27360:27516, ack 1, win 501, length 156
01:57:33.409231 IP 134.122.47.167.ssh > 38.64.227.143.56749: Flags [P.], seq 27516:27672, ack 1, win 501, length 156
01:57:33.409284 IP 134.122.47.167.ssh > 38.64.227.143.56749: Flags [P.], seq 27672:27828, ack 1, win 501, length 156
01:57:33.409339 IP 134.122.47.167.ssh > 38.64.227.143.56749: Flags [P.], seq 27828:27984, ack 1, win 501, length 156
01:57:33.432465 IP 38.64.227.143.56749 > 134.122.47.167.ssh: Flags [.], ack 16836, win 510, length 0
01:57:33.432523 IP 134.122.47.167.ssh > 38.64.227.143.56749: Flags [P.], seq 27984:28140, ack 1, win 501, length 156
01:57:33.432540 IP 38.64.227.143.56749 > 134.122.47.167.ssh: Flags [.], ack 18564, win 509, length 0
01:57:33.432551 IP 38.64.227.143.56749 > 134.122.47.167.ssh: Flags [.], ack 20520, win 508, length 0
01:57:33.432573 IP 38.64.227.143.56749 > 134.122.47.167.ssh: Flags [.], ack 27360, win 512, length 0
01:57:33.432778 IP 134.122.47.167.ssh > 38.64.227.143.56749: Flags [P.], seq 28140:28704, ack 1, win 501, length 564
01:57:33.432852 IP 134.122.47.167.ssh > 38.64.227.143.56749: Flags [P.], seq 28704:28860, ack 1, win 501, length 156
01:57:33.432947 IP 134.122.47.167.ssh > 38.64.227.143.56749: Flags [P.], seq 28860:29016, ack 1, win 501, length 156
01:57:33.433036 IP 134.122.47.167.ssh > 38.64.227.143.56749: Flags [P.], seq 29016:29172, ack 1, win 501, length 156
01:57:33.433113 IP 134.122.47.167.ssh > 38.64.227.143.56749: Flags [P.], seq 29172:29328, ack 1, win 501, length 156
01:57:33.433190 IP 134.122.47.167.ssh > 38.64.227.143.56749: Flags [P.], seq 29328:29484, ack 1, win 501, length 156
01:57:33.433304 IP 134.122.47.167.ssh > 38.64.227.143.56749: Flags [P.], seq 29484:29640, ack 1, win 501, length 156
01:57:33.433375 IP 134.122.47.167.ssh > 38.64.227.143.56749: Flags [P.], seq 29640:29796, ack 1, win 501, length 156
01:57:33.433467 IP 134.122.47.167.ssh > 38.64.227.143.56749: Flags [P.], seq 29796:29952, ack 1, win 501, length 156
01:57:33.433554 IP 134.122.47.167.ssh > 38.64.227.143.56749: Flags [P.], seq 29952:30108, ack 1, win 501, length 156
01:57:33.433620 IP 134.122.47.167.ssh > 38.64.227.143.56749: Flags [P.], seq 30108:30264, ack 1, win 501, length 156
01:57:33.433689 IP 134.122.47.167.ssh > 38.64.227.143.56749: Flags [P.], seq 30264:30420, ack 1, win 501, length 156
01:57:33.433745 IP 134.122.47.167.ssh > 38.64.227.143.56749: Flags [P.], seq 30420:30576, ack 1, win 501, length 156
01:57:33.433807 IP 134.122.47.167.ssh > 38.64.227.143.56749: Flags [P.], seq 30576:30732, ack 1, win 501, length 156
01:57:33.433872 IP 134.122.47.167.ssh > 38.64.227.143.56749: Flags [P.], seq 30732:30888, ack 1, win 501, length 156
01:57:33.433928 IP 134.122.47.167.ssh > 38.64.227.143.56749: Flags [P.], seq 30888:31044, ack 1, win 501, length 156
01:57:33.434001 IP 134.122.47.167.ssh > 38.64.227.143.56749: Flags [P.], seq 31044:31200, ack 1, win 501, length 156
01:57:33.434060 IP 134.122.47.167.ssh > 38.64.227.143.56749: Flags [P.], seq 31200:31356, ack 1, win 501, length 156
01:57:33.434128 IP 134.122.47.167.ssh > 38.64.227.143.56749: Flags [P.], seq 31356:31512, ack 1, win 501, length 156
01:57:33.434192 IP 134.122.47.167.ssh > 38.64.227.143.56749: Flags [P.], seq 31512:31668, ack 1, win 501, length 156
01:57:33.434248 IP 134.122.47.167.ssh > 38.64.227.143.56749: Flags [P.], seq 31668:31824, ack 1, win 501, length 156
01:57:33.434312 IP 134.122.47.167.ssh > 38.64.227.143.56749: Flags [P.], seq 31824:31980, ack 1, win 501, length 156
01:57:33.434376 IP 134.122.47.167.ssh > 38.64.227.143.56749: Flags [P.], seq 31980:32136, ack 1, win 501, length 156
01:57:33.434445 IP 134.122.47.167.ssh > 38.64.227.143.56749: Flags [P.], seq 32136:32292, ack 1, win 501, length 156
01:57:33.434514 IP 134.122.47.167.ssh > 38.64.227.143.56749: Flags [P.], seq 32292:32448, ack 1, win 501, length 156
01:57:33.434569 IP 134.122.47.167.ssh > 38.64.227.143.56749: Flags [P.], seq 32448:32604, ack 1, win 501, length 156
01:57:33.434645 IP 134.122.47.167.ssh > 38.64.227.143.56749: Flags [P.], seq 32604:32760, ack 1, win 501, length 156
01:57:33.434717 IP 134.122.47.167.ssh > 38.64.227.143.56749: Flags [P.], seq 32760:32916, ack 1, win 501, length 156
01:57:33.434779 IP 134.122.47.167.ssh > 38.64.227.143.56749: Flags [P.], seq 32916:33072, ack 1, win 501, length 156
01:57:33.434840 IP 134.122.47.167.ssh > 38.64.227.143.56749: Flags [P.], seq 33072:33228, ack 1, win 501, length 156
01:57:33.434905 IP 134.122.47.167.ssh > 38.64.227.143.56749: Flags [P.], seq 33228:33384, ack 1, win 501, length 156
01:57:33.435004 IP 134.122.47.167.ssh > 38.64.227.143.56749: Flags [P.], seq 33384:33540, ack 1, win 501, length 156
01:57:33.435066 IP 134.122.47.167.ssh > 38.64.227.143.56749: Flags [P.], seq 33540:33696, ack 1, win 501, length 156
01:57:33.435134 IP 134.122.47.167.ssh > 38.64.227.143.56749: Flags [P.], seq 33696:33852, ack 1, win 501, length 156
01:57:33.435209 IP 134.122.47.167.ssh > 38.64.227.143.56749: Flags [P.], seq 33852:34008, ack 1, win 501, length 156
01:57:33.435322 IP 134.122.47.167.ssh > 38.64.227.143.56749: Flags [P.], seq 34008:34164, ack 1, win 501, length 156
01:57:33.435384 IP 134.122.47.167.ssh > 38.64.227.143.56749: Flags [P.], seq 34164:34320, ack 1, win 501, length 156
01:57:33.435447 IP 134.122.47.167.ssh > 38.64.227.143.56749: Flags [P.], seq 34320:34476, ack 1, win 501, length 156
01:57:33.435503 IP 134.122.47.167.ssh > 38.64.227.143.56749: Flags [P.], seq 34476:34632, ack 1, win 501, length 156
01:57:33.435562 IP 134.122.47.167.ssh > 38.64.227.143.56749: Flags [P.], seq 34632:34788, ack 1, win 501, length 156
01:57:33.435627 IP 134.122.47.167.ssh > 38.64.227.143.56749: Flags [P.], seq 34788:34944, ack 1, win 501, length 156
01:57:33.435683 IP 134.122.47.167.ssh > 38.64.227.143.56749: Flags [P.], seq 34944:35100, ack 1, win 501, length 156
01:57:33.435748 IP 134.122.47.167.ssh > 38.64.227.143.56749: Flags [P.], seq 35100:35256, ack 1, win 501, length 156
01:57:33.435816 IP 134.122.47.167.ssh > 38.64.227.143.56749: Flags [P.], seq 35256:35412, ack 1, win 501, length 156
01:57:33.435873 IP 134.122.47.167.ssh > 38.64.227.143.56749: Flags [P.], seq 35412:35568, ack 1, win 501, length 156
01:57:33.435926 IP 134.122.47.167.ssh > 38.64.227.143.56749: Flags [P.], seq 35568:35724, ack 1, win 501, length 156
01:57:33.435977 IP 134.122.47.167.ssh > 38.64.227.143.56749: Flags [P.], seq 35724:35880, ack 1, win 501, length 156
01:57:33.436039 IP 134.122.47.167.ssh > 38.64.227.143.56749: Flags [P.], seq 35880:36036, ack 1, win 501, length 156
01:57:33.436095 IP 134.122.47.167.ssh > 38.64.227.143.56749: Flags [P.], seq 36036:36192, ack 1, win 501, length 156
01:57:33.436149 IP 134.122.47.167.ssh > 38.64.227.143.56749: Flags [P.], seq 36192:36348, ack 1, win 501, length 156
01:57:33.436201 IP 134.122.47.167.ssh > 38.64.227.143.56749: Flags [P.], seq 36348:36504, ack 1, win 501, length 156
01:57:33.436263 IP 134.122.47.167.ssh > 38.64.227.143.56749: Flags [P.], seq 36504:36660, ack 1, win 501, length 156
01:57:33.436327 IP 134.122.47.167.ssh > 38.64.227.143.56749: Flags [P.], seq 36660:36816, ack 1, win 501, length 156
01:57:33.436383 IP 134.122.47.167.ssh > 38.64.227.143.56749: Flags [P.], seq 36816:36972, ack 1, win 501, length 156
01:57:33.436444 IP 134.122.47.167.ssh > 38.64.227.143.56749: Flags [P.], seq 36972:37128, ack 1, win 501, length 156
01:57:33.436500 IP 134.122.47.167.ssh > 38.64.227.143.56749: Flags [P.], seq 37128:37284, ack 1, win 501, length 156
01:57:33.436558 IP 134.122.47.167.ssh > 38.64.227.143.56749: Flags [P.], seq 37284:37440, ack 1, win 501, length 156
01:57:33.436611 IP 134.122.47.167.ssh > 38.64.227.143.56749: Flags [P.], seq 37440:37596, ack 1, win 501, length 156
01:57:33.436674 IP 134.122.47.167.ssh > 38.64.227.143.56749: Flags [P.], seq 37596:37752, ack 1, win 501, length 156
01:57:33.436729 IP 134.122.47.167.ssh > 38.64.227.143.56749: Flags [P.], seq 37752:37908, ack 1, win 501, length 156
01:57:33.436781 IP 134.122.47.167.ssh > 38.64.227.143.56749: Flags [P.], seq 37908:38064, ack 1, win 501, length 156
01:57:33.436863 IP 134.122.47.167.ssh > 38.64.227.143.56749: Flags [P.], seq 38064:38220, ack 1, win 501, length 156
01:57:33.436944 IP 134.122.47.167.ssh > 38.64.227.143.56749: Flags [P.], seq 38220:38376, ack 1, win 501, length 156
01:57:33.437002 IP 134.122.47.167.ssh > 38.64.227.143.56749: Flags [P.], seq 38376:38532, ack 1, win 501, length 156
01:57:33.437069 IP 134.122.47.167.ssh > 38.64.227.143.56749: Flags [P.], seq 38532:38688, ack 1, win 501, length 156
01:57:33.437166 IP 134.122.47.167.ssh > 38.64.227.143.56749: Flags [P.], seq 38688:38844, ack 1, win 501, length 156
01:57:33.437231 IP 134.122.47.167.ssh > 38.64.227.143.56749: Flags [P.], seq 38844:39000, ack 1, win 501, length 156
01:57:33.437286 IP 134.122.47.167.ssh > 38.64.227.143.56749: Flags [P.], seq 39000:39156, ack 1, win 501, length 156
01:57:33.437351 IP 134.122.47.167.ssh > 38.64.227.143.56749: Flags [P.], seq 39156:39312, ack 1, win 501, length 156
01:57:33.437410 IP 134.122.47.167.ssh > 38.64.227.143.56749: Flags [P.], seq 39312:39468, ack 1, win 501, length 156
01:57:33.437466 IP 134.122.47.167.ssh > 38.64.227.143.56749: Flags [P.], seq 39468:39624, ack 1, win 501, length 156
01:57:33.437517 IP 134.122.47.167.ssh > 38.64.227.143.56749: Flags [P.], seq 39624:39780, ack 1, win 501, length 156
01:57:33.437568 IP 134.122.47.167.ssh > 38.64.227.143.56749: Flags [P.], seq 39780:39936, ack 1, win 501, length 156
01:57:33.437619 IP 134.122.47.167.ssh > 38.64.227.143.56749: Flags [P.], seq 39936:40092, ack 1, win 501, length 156
01:57:33.437710 IP 134.122.47.167.ssh > 38.64.227.143.56749: Flags [P.], seq 40092:40248, ack 1, win 501, length 156
01:57:33.437795 IP 134.122.47.167.ssh > 38.64.227.143.56749: Flags [P.], seq 40248:40404, ack 1, win 501, length 156
01:57:33.437860 IP 134.122.47.167.ssh > 38.64.227.143.56749: Flags [P.], seq 40404:40560, ack 1, win 501, length 156
01:57:33.437918 IP 134.122.47.167.ssh > 38.64.227.143.56749: Flags [P.], seq 40560:40716, ack 1, win 501, length 156
01:57:33.437971 IP 134.122.47.167.ssh > 38.64.227.143.56749: Flags [P.], seq 40716:40872, ack 1, win 501, length 156
01:57:33.438026 IP 134.122.47.167.ssh > 38.64.227.143.56749: Flags [P.], seq 40872:41028, ack 1, win 501, length 156
01:57:33.438078 IP 134.122.47.167.ssh > 38.64.227.143.56749: Flags [P.], seq 41028:41184, ack 1, win 501, length 156
01:57:33.438132 IP 134.122.47.167.ssh > 38.64.227.143.56749: Flags [P.], seq 41184:41340, ack 1, win 501, length 156
01:57:33.438186 IP 134.122.47.167.ssh > 38.64.227.143.56749: Flags [P.], seq 41340:41496, ack 1, win 501, length 156
01:57:33.438238 IP 134.122.47.167.ssh > 38.64.227.143.56749: Flags [P.], seq 41496:41652, ack 1, win 501, length 156
01:57:33.438289 IP 134.122.47.167.ssh > 38.64.227.143.56749: Flags [P.], seq 41652:41808, ack 1, win 501, length 156
01:57:33.438352 IP 134.122.47.167.ssh > 38.64.227.143.56749: Flags [P.], seq 41808:41964, ack 1, win 501, length 156
01:57:33.438405 IP 134.122.47.167.ssh > 38.64.227.143.56749: Flags [P.], seq 41964:42120, ack 1, win 501, length 156
01:57:33.438456 IP 134.122.47.167.ssh > 38.64.227.143.56749: Flags [P.], seq 42120:42276, ack 1, win 501, length 156
01:57:33.438509 IP 134.122.47.167.ssh > 38.64.227.143.56749: Flags [P.], seq 42276:42432, ack 1, win 501, length 156
01:57:33.438560 IP 134.122.47.167.ssh > 38.64.227.143.56749: Flags [P.], seq 42432:42588, ack 1, win 501, length 156
01:57:33.438611 IP 134.122.47.167.ssh > 38.64.227.143.56749: Flags [P.], seq 42588:42744, ack 1, win 501, length 156
01:57:33.438665 IP 134.122.47.167.ssh > 38.64.227.143.56749: Flags [P.], seq 42744:42900, ack 1, win 501, length 156
01:57:33.438717 IP 134.122.47.167.ssh > 38.64.227.143.56749: Flags [P.], seq 42900:43056, ack 1, win 501, length 156
01:57:33.438781 IP 134.122.47.167.ssh > 38.64.227.143.56749: Flags [P.], seq 43056:43212, ack 1, win 501, length 156
01:57:33.438839 IP 134.122.47.167.ssh > 38.64.227.143.56749: Flags [P.], seq 43212:43368, ack 1, win 501, length 156
01:57:33.438890 IP 134.122.47.167.ssh > 38.64.227.143.56749: Flags [P.], seq 43368:43524, ack 1, win 501, length 156
01:57:33.438942 IP 134.122.47.167.ssh > 38.64.227.143.56749: Flags [P.], seq 43524:43680, ack 1, win 501, length 156
01:57:33.439015 IP 134.122.47.167.ssh > 38.64.227.143.56749: Flags [P.], seq 43680:43836, ack 1, win 501, length 156
01:57:33.439131 IP 134.122.47.167.ssh > 38.64.227.143.56749: Flags [P.], seq 43836:43992, ack 1, win 501, length 156
01:57:33.439163 IP 38.64.227.143.56749 > 134.122.47.167.ssh: Flags [.], ack 27984, win 509, length 0
01:57:33.439286 IP 134.122.47.167.ssh > 38.64.227.143.56749: Flags [P.], seq 43992:44252, ack 1, win 501, length 260
01:57:33.439367 IP 134.122.47.167.ssh > 38.64.227.143.56749: Flags [P.], seq 44252:44408, ack 1, win 501, length 156
01:57:33.439448 IP 134.122.47.167.ssh > 38.64.227.143.56749: Flags [P.], seq 44408:44564, ack 1, win 501, length 156
01:57:33.439529 IP 134.122.47.167.ssh > 38.64.227.143.56749: Flags [P.], seq 44564:44720, ack 1, win 501, length 156
01:57:33.439612 IP 134.122.47.167.ssh > 38.64.227.143.56749: Flags [P.], seq 44720:44876, ack 1, win 501, length 156
01:57:33.439713 IP 134.122.47.167.ssh > 38.64.227.143.56749: Flags [P.], seq 44876:45032, ack 1, win 501, length 156
01:57:33.439801 IP 134.122.47.167.ssh > 38.64.227.143.56749: Flags [P.], seq 45032:45188, ack 1, win 501, length 156
01:57:33.439882 IP 134.122.47.167.ssh > 38.64.227.143.56749: Flags [P.], seq 45188:45344, ack 1, win 501, length 156
01:57:33.439941 IP 134.122.47.167.ssh > 38.64.227.143.56749: Flags [P.], seq 45344:45500, ack 1, win 501, length 156
01:57:33.440017 IP 134.122.47.167.ssh > 38.64.227.143.56749: Flags [P.], seq 45500:45656, ack 1, win 501, length 156
01:57:33.440102 IP 134.122.47.167.ssh > 38.64.227.143.56749: Flags [P.], seq 45656:45812, ack 1, win 501, length 156
01:57:33.440178 IP 134.122.47.167.ssh > 38.64.227.143.56749: Flags [P.], seq 45812:45968, ack 1, win 501, length 156
01:57:33.440231 IP 134.122.47.167.ssh > 38.64.227.143.56749: Flags [P.], seq 45968:46124, ack 1, win 501, length 156
01:57:33.440288 IP 134.122.47.167.ssh > 38.64.227.143.56749: Flags [P.], seq 46124:46280, ack 1, win 501, length 156
01:57:33.440348 IP 134.122.47.167.ssh > 38.64.227.143.56749: Flags [P.], seq 46280:46436, ack 1, win 501, length 156
01:57:33.440426 IP 134.122.47.167.ssh > 38.64.227.143.56749: Flags [P.], seq 46436:46592, ack 1, win 501, length 156
01:57:33.440491 IP 134.122.47.167.ssh > 38.64.227.143.56749: Flags [P.], seq 46592:46748, ack 1, win 501, length 156
01:57:33.440552 IP 134.122.47.167.ssh > 38.64.227.143.56749: Flags [P.], seq 46748:46904, ack 1, win 501, length 156
01:57:33.440624 IP 134.122.47.167.ssh > 38.64.227.143.56749: Flags [P.], seq 46904:47060, ack 1, win 501, length 156
01:57:33.440684 IP 134.122.47.167.ssh > 38.64.227.143.56749: Flags [P.], seq 47060:47216, ack 1, win 501, length 156
01:57:33.440743 IP 134.122.47.167.ssh > 38.64.227.143.56749: Flags [P.], seq 47216:47372, ack 1, win 501, length 156
01:57:33.440799 IP 134.122.47.167.ssh > 38.64.227.143.56749: Flags [P.], seq 47372:47528, ack 1, win 501, length 156
01:57:33.440859 IP 134.122.47.167.ssh > 38.64.227.143.56749: Flags [P.], seq 47528:47684, ack 1, win 501, length 156
01:57:33.440912 IP 134.122.47.167.ssh > 38.64.227.143.56749: Flags [P.], seq 47684:47840, ack 1, win 501, length 156
01:57:33.440971 IP 134.122.47.167.ssh > 38.64.227.143.56749: Flags [P.], seq 47840:47996, ack 1, win 501, length 156
01:57:33.441026 IP 134.122.47.167.ssh > 38.64.227.143.56749: Flags [P.], seq 47996:48152, ack 1, win 501, length 156
01:57:33.441090 IP 134.122.47.167.ssh > 38.64.227.143.56749: Flags [P.], seq 48152:48308, ack 1, win 501, length 156
01:57:33.441201 IP 134.122.47.167.ssh > 38.64.227.143.56749: Flags [P.], seq 48308:48464, ack 1, win 501, length 156
01:57:33.441269 IP 134.122.47.167.ssh > 38.64.227.143.56749: Flags [P.], seq 48464:48620, ack 1, win 501, length 156
01:57:33.441327 IP 134.122.47.167.ssh > 38.64.227.143.56749: Flags [P.], seq 48620:48776, ack 1, win 501, length 156
01:57:33.441412 IP 134.122.47.167.ssh > 38.64.227.143.56749: Flags [P.], seq 48776:48932, ack 1, win 501, length 156
01:57:33.441494 IP 134.122.47.167.ssh > 38.64.227.143.56749: Flags [P.], seq 48932:49088, ack 1, win 501, length 156
01:57:33.441584 IP 134.122.47.167.ssh > 38.64.227.143.56749: Flags [P.], seq 49088:49244, ack 1, win 501, length 156
01:57:33.441671 IP 134.122.47.167.ssh > 38.64.227.143.56749: Flags [P.], seq 49244:49400, ack 1, win 501, length 156
01:57:33.441766 IP 134.122.47.167.ssh > 38.64.227.143.56749: Flags [P.], seq 49400:49556, ack 1, win 501, length 156
01:57:33.441848 IP 134.122.47.167.ssh > 38.64.227.143.56749: Flags [P.], seq 49556:49712, ack 1, win 501, length 156
01:57:33.441937 IP 134.122.47.167.ssh > 38.64.227.143.56749: Flags [P.], seq 49712:49868, ack 1, win 501, length 156
01:57:33.442004 IP 134.122.47.167.ssh > 38.64.227.143.56749: Flags [P.], seq 49868:50024, ack 1, win 501, length 156
01:57:33.442065 IP 134.122.47.167.ssh > 38.64.227.143.56749: Flags [P.], seq 50024:50180, ack 1, win 501, length 156
01:57:33.442119 IP 134.122.47.167.ssh > 38.64.227.143.56749: Flags [P.], seq 50180:50336, ack 1, win 501, length 156
01:57:33.442176 IP 134.122.47.167.ssh > 38.64.227.143.56749: Flags [P.], seq 50336:50492, ack 1, win 501, length 156
01:57:33.442384 IP 134.122.47.167.ssh > 38.64.227.143.56749: Flags [P.], seq 50492:50648, ack 1, win 501, length 156
01:57:33.442494 IP 134.122.47.167.ssh > 38.64.227.143.56749: Flags [P.], seq 50648:50804, ack 1, win 501, length 156
01:57:33.442601 IP 134.122.47.167.ssh > 38.64.227.143.56749: Flags [P.], seq 50804:50960, ack 1, win 501, length 156
01:57:33.442814 IP 134.122.47.167.ssh > 38.64.227.143.56749: Flags [P.], seq 50960:51116, ack 1, win 501, length 156
01:57:33.442927 IP 134.122.47.167.ssh > 38.64.227.143.56749: Flags [P.], seq 51116:51272, ack 1, win 501, length 156
01:57:33.443049 IP 134.122.47.167.ssh > 38.64.227.143.56749: Flags [P.], seq 51272:51428, ack 1, win 501, length 156
01:57:33.443151 IP 134.122.47.167.ssh > 38.64.227.143.56749: Flags [P.], seq 51428:51584, ack 1, win 501, length 156
01:57:33.443278 IP 134.122.47.167.ssh > 38.64.227.143.56749: Flags [P.], seq 51584:51740, ack 1, win 501, length 156
01:57:33.443376 IP 134.122.47.167.ssh > 38.64.227.143.56749: Flags [P.], seq 51740:51896, ack 1, win 501, length 156
01:57:33.443460 IP 134.122.47.167.ssh > 38.64.227.143.56749: Flags [P.], seq 51896:52052, ack 1, win 501, length 156
01:57:33.443544 IP 134.122.47.167.ssh > 38.64.227.143.56749: Flags [P.], seq 52052:52208, ack 1, win 501, length 156
01:57:33.443630 IP 134.122.47.167.ssh > 38.64.227.143.56749: Flags [P.], seq 52208:52364, ack 1, win 501, length 156
01:57:33.443713 IP 134.122.47.167.ssh > 38.64.227.143.56749: Flags [P.], seq 52364:52520, ack 1, win 501, length 156
01:57:33.457493 IP 38.64.227.143.56749 > 134.122.47.167.ssh: Flags [.], ack 30264, win 513, length 0
01:57:33.457553 IP 134.122.47.167.ssh > 38.64.227.143.56749: Flags [P.], seq 52520:52676, ack 1, win 501, length 156
01:57:33.457739 IP 134.122.47.167.ssh > 38.64.227.143.56749: Flags [P.], seq 52676:52936, ack 1, win 501, length 260
01:57:33.457808 IP 134.122.47.167.ssh > 38.64.227.143.56749: Flags [P.], seq 52936:53092, ack 1, win 501, length 156
01:57:33.457868 IP 134.122.47.167.ssh > 38.64.227.143.56749: Flags [P.], seq 53092:53248, ack 1, win 501, length 156
01:57:33.457927 IP 134.122.47.167.ssh > 38.64.227.143.56749: Flags [P.], seq 53248:53404, ack 1, win 501, length 156
01:57:33.457992 IP 134.122.47.167.ssh > 38.64.227.143.56749: Flags [P.], seq 53404:53560, ack 1, win 501, length 156
01:57:33.458053 IP 134.122.47.167.ssh > 38.64.227.143.56749: Flags [P.], seq 53560:53716, ack 1, win 501, length 156
01:57:33.458149 IP 134.122.47.167.ssh > 38.64.227.143.56749: Flags [P.], seq 53716:53872, ack 1, win 501, length 156
01:57:33.458249 IP 134.122.47.167.ssh > 38.64.227.143.56749: Flags [P.], seq 53872:54028, ack 1, win 501, length 156
01:57:33.458336 IP 134.122.47.167.ssh > 38.64.227.143.56749: Flags [P.], seq 54028:54184, ack 1, win 501, length 156
01:57:33.458402 IP 134.122.47.167.ssh > 38.64.227.143.56749: Flags [P.], seq 54184:54340, ack 1, win 501, length 156
01:57:33.458462 IP 134.122.47.167.ssh > 38.64.227.143.56749: Flags [P.], seq 54340:54496, ack 1, win 501, length 156
01:57:33.458522 IP 134.122.47.167.ssh > 38.64.227.143.56749: Flags [P.], seq 54496:54652, ack 1, win 501, length 156
01:57:33.458585 IP 134.122.47.167.ssh > 38.64.227.143.56749: Flags [P.], seq 54652:54808, ack 1, win 501, length 156
01:57:33.458645 IP 134.122.47.167.ssh > 38.64.227.143.56749: Flags [P.], seq 54808:54964, ack 1, win 501, length 156
01:57:33.458700 IP 134.122.47.167.ssh > 38.64.227.143.56749: Flags [P.], seq 54964:55120, ack 1, win 501, length 156
01:57:33.461935 IP 38.64.227.143.56749 > 134.122.47.167.ssh: Flags [.], ack 32136, win 512, length 0
01:57:33.461969 IP 134.122.47.167.ssh > 38.64.227.143.56749: Flags [P.], seq 55120:55276, ack 1, win 501, length 156
01:57:33.461983 IP 38.64.227.143.56749 > 134.122.47.167.ssh: Flags [.], ack 35880, win 509, length 0
01:57:33.462009 IP 38.64.227.143.56749 > 134.122.47.167.ssh: Flags [.], ack 39936, win 512, length 0
